NUMERO,PERGUNTA,RESP1,RESP2,RESP3,RESP4,CERTA,TIPO,FLAG,JA_FOI,MATERIA
4407,"A REVOLUÇÃO FEDERALISTA OCORREU EM QUAL ESTADO BRASILEIRO?","RIO GRANDE DO SUL","SÃO PAULO","GOIÁS","TOCANTINS","1","D",,"N","H"
4408,"QUAL O APELIDO QUE RECEBEU D. JOÃO III, REI DE PORTUGAL?","O PIEDOSO","O CONQUISTADOR","O GRANDE","O PACIFICADOR","1","D",,"N","H"
4409,"DURANTE QUAL GOVERNO OCORREU A REVOLTA DA CHIBATA?","VENCESLAU BRÁS","HERMES DA FONSECA","MARECHAL DEODORO","FLORIANO PEIXOTO","2","D",,"N","H"
4410,"A DEUSA DA SABEDORIA ERA:","ATENA","HEBE","AFRODITE","ANTÍGONA","1","D",,"N","H"
4411,"QUAL O NOME DO DOCUMENTO ASSINADO POR JOÃO SEM TERRA EM 1215?","MAGNA CARTA","CONSTITUIÇÃO INGLESA","TRATADO DE PAZ","TRATADO DE TORDESILHAS","1","D",,"N","H"
4412,"QUEM SUCEDEU VARGAS DEPOIS DA SUA MORTE?","TANCREDO NEVES","ITAMAR FRANCO","CAFÉ FILHO","MAGALHÃES PINTO","3","D",,"N","H"
4413,"NA MITOLOGIA GREGA, A DEUSA DA ETERNA JUVENTUDE ERA:","ATENA","HEBE","AFRODITE","AMAZONA","2","D",,"N","H"
4414,"QUANDO TERMINOU A GUERRA ENTRE FRANÇA E RÚSSIA?","1755","1690","1515","1871","4","D",,"N","H"
4415,"EM QUE ANO A ALEMANHA SE TORNOU UM ESTADO MODERNO?","1788","1781","1870","1871","4","D",,"N","H"
4428,"QUE PERSONAGEM DA MITOLOGIA GREGA CORTOU A CABEÇA DE MEDUSA?","TESEU","PERSEU","PIDNA","TELÊMACO","2","D",,"N","H"
4417,"QUAL O SIGNIFICADO DA SIGLA ARENA?","ALIANÇA RESTRITA AO NACIONALISMO","ALIANÇA RENOVADORA NACIONAL","ACORDO DE RENOVAÇÃO NACIONALISTA","ATRITO REUNIFICADOR NATIVO","2","D",,"N","H"
4406,"DURANTE QUAL PERÍODO A ALEMANHA ERA DENOMINADA REPÚBLICA DE WEIMAR?","1919 A 1933","1925 A 1935","1933 A 1945","1927 A 1945","1","D",,"N","H"
4419,"DURANTE QUAL PERÍODO OCORREU A GUERRA DOS CEM ANOS?","1337 A 1453","1337 A 1437","1453 A 1553","1337 A 1455","1","D",,"N","H"
4420,"EM QUE ANO FOI ASSINADO O TRATADO DA SANTA ALIANÇA?","1820","1813","1814","1815","4","D",,"N","H"
4421,"QUEM COMANDOU A REBELIÃO MILITAR QUE INICIOU A REPÚBLICA EM 1889?","MARECHAL DEODORO DA FONSECA","RUI BARBOSA","WASHINGTON LUÍS","MARECHAL FLORIANO PEIXOTO","1","D",,"N","H"
4422,"O NOME ""HÉLADE"" ERA USADO NO PERÍODO CLÁSSICO. ELE SE REFERE A QUAL PAÍS?","GRÉCIA","ITÁLIA","PÉRSIA","ROMA","1","D",,"N","H"
4423,"QUAL O NOME DO ACORDO ASSINADO POR AFONSO II DE ARAGÃO E AFONSO VIII DE CASTELA?","ACORDO INTERNACIONAL","ACORDO DE POTSDAM","ACORDO DE CARTAGENA","ACORDO DE CAZORLA","4","D",,"N","H"
4424,"QUAL O NOME DO PLANO COMUNISTA QUE JUSTIFICOU O GOLPE DE 1937?","COHEN","MARSHALL","DAWES","DE METAS","1","D",,"N","H"
1136,"QUAL É A COR DA GEMA DO OVO?","BLUE","BROWN","GREEN","YELLOW","4","A",,"N","I"
1135,"TRUCK CORRESPONDE A QUAL DESSES MEIOS DE TRANSPORTE?","METRÔ","CAMINHÃO","MOTO","ÔNIBUS","2","A",,"N","I"
1169,"SINGER É O NOME DADO A QUAL DESSAS PROFISSÕES?","CARTEIRO","PADEIRO","CANTOR","DETETIVE","3","A",,"N","I"
1171,"QUAL É O SIGNIFICADO DA PALAVRA ""TALL"", NA FRASE: ""JANE IS VERY TALL.""?","GORDA","BAIXA","MAGRA","ALTA","4","A",,"N","I"
1146,"QUAL DESSAS FRUTAS CORRESPONDE AO MORANGO?","STRAWBERRY","PINEAPPLE","CHERRY","PEACH","1","A",,"N","I"
1180,"QUAL É O SIGNIFICADO DO VERBO ""TO FORGET""?","ESQUECER","MACHUCAR","LEMBRAR","PERGUNTAR","1","A",,"N","I"
1179,"QUAL É O SIGNIFICADO DA FRASE: ""MY AUNT IS SICK.""?","MEU PRIMO ESTÁ ALEGRE","MINHA AVÓ VIAJOU","MEU SOBRINHO GRITOU","MINHA TIA ESTÁ DOENTE","4","A",,"N","I"
1178,"GREY CORRESPONDE A QUAL DESSAS CORES?","VERDE","MARROM","CINZA","ROSA","3","A",,"N","I"
1177,"QUANTAS CONSOANTES POSSUI A PALAVRA ""TURTLE""?","TWO","FOUR","FIVE","THREE","2","A",,"N","I"
1176,"O QUE SIGNIFICA A EXPRESSÃO ""TANKS""?","ESPERE","OBRIGADO","ATÉ LOGO","POR FAVOR","4","A",,"N","I"
1175,"BLACK CORRESPONDE A QUAL DESSAS CORES?","VERMELHO","AZUL","VERDE","PRETO","4","A",,"N","I"
1174,"QUAL ESTAÇÃO DO ANO É CONHECIDA COMO ÉPOCA DAS FLORES?","SUMMER","SPRING","AUTUMN","WINTER","2","A",,"N","I"
1173,"QUAL É O FEMININO DE FATHER?","DAUGHTER","GRANDMOTHER","SISTER","MOTHER","4","A",,"N","I"
1172,"COMO SE DIZ ""GOLFINHO"" EM INGLÊS?","PIG","DOLPHIN","HORSE","SEAL","2","A",,"N","I"
1158,"QUAL É O PLURAL DE ""PEOPLE""?","PEOPLYS","PEOPLE","PEOPLES","PEOPLIES","2","A",,"N","I"
1170,"A FRASE: ""HE WILL DRINK A TEA"" SIGNIFICA:","ELE VAI TOMAR UM CHÁ","ELA VAI TOMAR UM BANHO","ELES VÃO LIMPAR A CASA","ELA VAI LAVAR A LOUÇA","1","A",,"N","I"
1182,"COMO SE DIZ ""AQUELA CANETA É BRANCA"", EM INGLÊS?","THAT PEN IS WHITE","THIS PENCIL IS WHITE","THOSE PENS ARE WHITE","THAT PENCIL IS WHITE","1","A",,"N","I"
1168,"QUAL DESSES ANIMAIS NÃO VIVE NA ÁGUA?","EAGLE","WHALE","OCTOPUS","SHARK","1","A",,"N","I"
1167,"QUAL DESSAS PEÇAS DE ROUPA É APENAS FEMININA?","SOCKS","DRESS","TROUSERS","SHIRT","2","A",,"N","I"
1166,"QUAL DESSAS PALAVRAS NÃO CORRESPONDE A UM DOS MEMBROS DO CORPO?","DRESS","MOUTH","LEG","HAND","1","A",,"N","I"
1165,"QUAL DESSAS ALTERNATIVAS CORRESPONDE À PALAVRA ""IGREJA"" EM INGLÊS?","STATION","CHURCH","SUBWAY","OFFICE","2","A",,"N","I"
1164,"EM QUAL DESSES PONTOS COMERCIAIS SE PRODUZ PÃO?","BAKER","TEACHER","SAILOR","POSTMAN","1","A",,"N","I"
1163,"QUAL DESSAS ALTERNATIVAS NÃO CORRESPONDE A UM TIPO DE ANIMAL?","CAT","CLOWN","GIRAFF","DUCK","2","A",,"N","I"
1162,"SUNFLOWER É UM TIPO DE FLOR DE COR:","VIOLETA","BRANCA","AMARELA","VERMELHA","3","A",,"N","I"
1161,"QUAL É O ANTÔNIMO DE ""LIFE""?","GROW","BIRTH","DEATH","BORN","3","A",,"N","I"
1160,"QUAL DESSAS PALAVRAS SIGNIFICA ""GAIOLA""?","CAGE","BOAT","HAT","ROCKET","1","A",,"N","I"
1159,"COMO SE DIZ: ""ESTOU MUITO ORGULHOSO DE VOCÊ"", EM INGLÊS?","I AM VERY PROUD OF YOU","I HATE YOU","I AM LOOKING FOR YOU","I NEED YOU","1","A",,"N","I"
1060,"QUAL DESSAS PREPOSIÇÕES TEM COMO SIGNIFICADO ""DEBAIXO DE""?","ON","BETWEEN","INSIDE","UNDER","4","A",,"N","I"
1556,"COMO SE ESCREVE O NÚMERO 2.000 EM INGLÊS?","TWO THOUSAND","TWENTY","TWO HUNDRED","TWELVE","1","A",,"N","I"
1703,"QUAL DESSES ALIMENTOS É CONHECIDO COMO ""JELLY""?","SORVETE","BOLO","GELATINA","TORTA","3","A",,"N","I"
1702,"COMO SE DIZ ""ENGRAÇADO"" EM INGLÊS?","SHY","LOOSER","BORING","FUNNY","4","A",,"N","I"
1701,"QUEEN EM PORTUGUÊS SIGNIFICA:","MADRINHA","PRINCESA","FREIRA","RAINHA","4","A",,"N","I"
1700,"A EXPRESSÃO ""TURN LEFT"", SIGNIFICA:","VIRE A DIREITA","SIGA EM FRENTE","VIRE A ESQUERDA","PARE","3","A",,"N","I"
1699,"A PALAVRA ""KNEE"" REFERE-SE A QUAL PARTE DO CORPO?","JOELHO","CABEÇA","BRAÇO","OMBRO","1","A",,"N","I"
1698,"QUAL É O SIGNIFICADO DO VERBO ""TO WRITE""?","ABRAÇAR","BATER","ESCREVER","COMER","3","A",,"N","I"
1697,"KIDNAP É O MESMO QUE:","SEQUESTRAR","COMPRAR","VENDER","PAGAR","1","A",,"N","I"
1696,"QUAL É O SIGNIFICADO DA FRASE: ""I DO NOT WANT TO CLOSE MY EYES""?","NÃO QUERO ABRIR A JANELA","NÃO ESTOU ME SENTINDO BEM","NÃO QUERO FECHAR OS OLHOS","NÃO SEI O QUE DIZER","3","A",,"N","I"
1695,"QUAL É O MASCULINO DE ""DAUGHTER""?","BROTHER","AUNT","UNCLE","SON","4","A",,"N","I"
1694,"TO BE AFRAID SIGNIFICA ESTAR:","OCUPADO","COM MEDO","CONTENTE","CALMO","2","A",,"N","I"
1680,"COMO SE ESCREVE ""RÉGUA"" EM INGLÊS?","PENCIL","RULER","DESK","RUBBER","2","A",,"N","I"
1692," LIKE A FISH _____ WATER  IS A WELL-KNOWN IDIOM. IF YOU FEEL LIKE THIS, YOU FEEL DIFFERENT FROM EVERYONE ELSE.","UNDER","IN GOD WE TRUST","OUT OF","OVER","3","A",,"N","I"
1704,"CHOOSE THE CORRECT ANSWER. HOW WONDERFUL! I'VE GOT MONEY IN THE BANK AGAIN SO I´M BACK IN THE _______________.","BLACK","YELLOW","RED","GREEN","1","A",,"N","I"
1690,"SHE WENT ON A DIET BECAUSE OF HER HIGH BLOOD __________________.","TENSION","INFLAMMATION","PRESSURE","POISONING","3","A",,"N","I"
1689,"TEETH É O MESMO QUE:","LÁBIO","LÍNGUA","ORELHA","DENTE","4","A",,"N","I"
1688,"SAFE IS AN ADJECTIVE, WHAT IS ITS RELATED NOUN?","SAFETY","SAFELY","SAFENESS","SAFER","1","A",,"N","I"
1687,"SALA DE JANTAR EM INGLÊS É:","KITCHEN","LIVING ROOM","BATHROON","DINNING ROOM","4","A",,"N","I"
1686,"TYRE É UMA PEÇA QUE PERTENCE A QUAL DESSES OBJETOS?","VIOLÃO","TELEVISÃO","LÁPIS","CARRO","4","A",,"N","I"
1685,"BOILED POTATOES É O MESMO QUE:","BATATA FRITA","BATATA ASSADA","BATATA COZIDA","BATATA GRELHADA","3","A",,"N","I"
1684,"VINHO EM INGLÊS SE ESCREVE:","BEER","JUICE","TEA","WINE","4","A",,"N","I"
1683,"QUAL DESSAS PALAVRAS SIGNIFICA ""JURAR""?","SWEAR","PRAY","SCREAM","HUG","1","A",,"N","I"
1682,"A FRASE: ""SHE HAS GOT CURLY HAIR"", SIGNIFICA:","ELA TEM CABELOS LOIROS","ELE TEM CABELOS CURTOS","ELA TEM CABELOS ENCARACOLADOS","ELE TEM CABELOS LISOS","3","A",,"N","I"
1716,"QUAL É O SIGNIFICADO DA FRASE: ""I WILL PAINT THE WALLS""?","EU VOU PINTAR AS PAREDES","EU DESENHEI UM PÁSSARO","EU PINTEI MINHAS UNHAS","EU VOU DESENHAR UMA PINÇA","1","A",,"N","I"
1691,"SUSAN IS LUCKY BECAUSE SHE ____________ CATCHES A COLD.","RARE","RARELY","SCARCELY","HARDLY","2","A",,"N","I"
1693,"NEIGHBOR É O MESMO QUE:","PRIMA","VIZINHO","MADRINHA","NAMORADO","2","A",,"N","I"
1728,"HOW DO YOU SPELL THE WORD WHICH MEANS THAT SOMEONE IS EASILY FRIGHTENED?","COWARD","COWERD","COUERD","COWART","1","A",,"N","I"
1727,"QUAL DESSAS RESPOSTAS É MAIS ADEQUADA PARA A PERGUNTA: ""HOW OLD ARE YOU?""","I AM TWEENTY","I AM IN LONDON","I AM GOING TO COLLEGE","I AM A TEACHER","1","A",,"N","I"
1726,"COMPLETE THE SENTENCE ""I HAVE BEEN ____________ ALL NIGHT"".","STUDYING","FINISHED","WAKE UP","CRY","1","A",,"N","I"
1805,"WHAT IS THE PREDOMINANT LANGUAGE SPOKEN IN QUEBEC?","ENGLISH","DANISH","GERMAN","FRENCH","4","A",,"N","I"
1797,"WHAT IS THE MAIN INGREDIENT IN A TRADITIONAL HAMBURGUER?","VEAL","TURKEY","ROST BEEF","BEEF","4","A",,"N","I"
1824,"CHOOSE THE CORRECT VERB:  I CAN´T HEAR THE RADIO. CAN YOU ________ IT UP, PLEASE?","MAKE A LIVING","KEEP","TURN","SWITCH","3","A",,"N","I"
1826,"CHOOSE THE CORRECT SPELLING OF THE WORD FOR A GROUP OF COWS:","HURD","HEARD","HERD","HERDE","3","A",,"N","I"
1825,"IN BRITISH ENGLISH WE ASK FOR THE BILL IN A RESTAURANT AT THE END OF A MEAL. WHAT DO AMERICANS ASK FOR?","THE CHECK","THE RECEIPT","THE SCRIPT","THE BILL","1","A",,"N","I"
1743,"COMPLETE A SEQÜÊNCIA: TEN, TWENTY, THIRTY, ... ","FOUR","FOURTEEN","FORTY","FOURTEENTH","3","A",,"N","I"
1758,"QUAL É O ADVÉRBIO DE TEMPO QUE CORRESPONDE AO TERMO ""ONTEM""?","ALWAYS","NEVER","YESTERDAY","TOMORROW","3","A",,"N","I"
940,"COMPLETE: ""WHERE ARE MY SHOES? - I CAN NOT FIND______ .""","THEIR","THEY","THEM","THEIRS","3","A",,"N","I"
941,"FREE SIGNIFICA:","DESCONTO","GRÁTIS","À VENDA","LEILÃO","2","A",,"N","I"
942,"SOBREMESA EM INGLÊS É:","DESSERT","DINNER","BREAKFAST","LUNCH","1","A",,"N","I"
952,"COMPLETE A FRASE: ""HE IS               THE MOUNTAIN.""","EATING","DRIVING","RIDING","CLIMBING","4","A",,"N","I"
944,"COMO SE DIZ ""ESTOU COM FRIO"" EM INGLÊS?","I AM HUNGRY","I AM BAD","I AM TIRED","I AM COLD","4","A",,"N","I"
937,"COMO DIZEMOS: ""ESTA CADEIRA É FEITA DE MADEIRA""?","THIS CHAIR IS MADE OF WOOD","THIS CHAIR LOOKS LIKE WOOD","THAT CHAIR IS MADE OF GLASS","THAT CHAIR LOOKS LIKE WOOD","1","A",,"N","I"
946,"O ADJETIVO ""SINGLE"" SIGNIFICA:","SOLTEIRA","CASADA","VIÚVA","DISQUITADA","1","A",,"N","I"
947,"SPRING CORRESPONDE A QUAL ESTAÇÃO DO ANO?","INVERNO","VERÃO","PRIMAVERA","OUTONO","3","A",,"N","I"
948,"COMPLETE A FRASE: ""HOW _______ HAVE YOU BEEN HERE?""","LONG","MUCH","MANY","DO","1","A",,"N","I"
949,"QUAL É A PREPOSIÇÃO APROPRIADA PARA A AFIRMAÇÃO: ""THE KEYS ARE ____ THE POCKET.""?","TO","FROM","IN","BETWEEN","3","A",,"N","I"
950,"QUAL É O PLURAL DA PALAVRA ""WOMAN""?","WOMANS","WOMEN","WOMENS","WEMANS","2","A",,"N","I"
951,"SWEET É UM ADJETIVO DADO A ALGO:","DOCE","SALGADO","AMARGO","AZEDO","1","A",,"N","I"
728,"COMPLETE: ""THOSE CARS WERE MADE _____ PLASTIC.""","FROM","SINCE","OF","GOT","3","A",,"N","I"
531,"SNOW É O NOME DADO A QUAL DESSES FENÔMENOS?","NEVE","CHUVA","VENTO","TROVÃO","1","A",,"N","I"
790,"SNAKE É O NOME QUE CORRESPONDE A QUAL DESSES ANIMAIS?","CAMELO","TUBARÃO","TARTARUGA","COBRA","4","A",,"N","I"
599,"SIT DOWN SIGNIFICA:","LEVANTAR-SE","PULAR","SENTAR-SE","GRITAR","3","A",,"N","I"
600,"QUAL É A RESPOSTA CORRETA PARA: ""WHAT IS YOUR JOB?""?","I AM A LAWYER","I AM TWENTY","I AM SURE ABOUT THAT","NO, I AM NOT","1","A",,"N","I"
601,"O QUE SIGNIFICA ""BIG NOSE""?","OLHOS GRANDES","BOCA PEQUENA","NARIZ GRANDE","ORELHAS PEQUENAS","3","A",,"N","I"
602,"BREAKFAST É O MESMO QUE:","SOBREMESA","ALMOÇO","JANTAR","CAFÉ DA MANHÃ","4","A",,"N","I"
612,"KITCHEN SIGNIFICA:","QUARTO","GARAGEM","COZINHA","BANHEIRO","3","A",,"N","I"
604,"COMO SE DIZ: ""ESTOU COM SEDE""?","I AM THIRSTY","I AM CRAZY","I AM SICK","I AM HUNGRY","1","A",,"N","I"
597,"PUT ON YOUR GLOVES SIGNIFICA:","COLOQUE SEU CAPUZ","TIRE SUAS MEIAS","COLOQUE SUAS LUVAS","TIRE SEU CASACO","3","A",,"N","I"
606,"QUAL PALAVRA COMPLETA CORRETAMENTE A PERGUNTA: ""HOW MUCH ________ DO YOU HAVE?","BOOKS","FRIENDS","APPLES","MONEY","4","A",,"N","I"
607,"QUAL É A RESPOSTA CORRETA PARA: ""HAVE YOU GOT A MAP?""?","NO, THEY HAVE NOT","YES, HE HAS","NO, I HAS NOT","YES, I HAVE","4","A",,"N","I"
608,"COMPLETE A FRASE: ""IF I WORKED NEARER HOME, I _____________ MORE FREE TIME"".","MUST BUY","WILL STAY","WOULD HAVE","WILL NOT PRAY","3","A",,"N","I"
609,"COMO SE DIZ ""FELIZ ANIVERSÁRIO"" EM INGLÊS?","HAPPY HOUR","HAPPY BIRTHDAY","HAPPY WEEKEND","HAPPY HOLLIDAY","2","A",,"N","I"
610,"COMO SE DIZ ""SEGUNDA-FEIRA"" EM INGLÊS?","FRIDAY","WEDNESDAY","MONDAY","TUESDAY","3","A",,"N","I"
611,"BOLO EM INGLÊS ESCREVE-SE:","SHAKE","SNAKE","MAKE","CAKE","4","A",,"N","I"
589,"A EXPRESSÃO ""TAKE OF YOUR SHOES"" SIGNIFICA:","TIRE SEUS SAPATOS","VISTA SUA CALÇA","TIRE SUAS MEIAS","VISTA SUA BLUSA","1","A",,"N","I"
587,"COMO SE ESCREVE ""CÉU"" EM INGLÊS?","SUN","SKY","STAR","MOON","2","A",,"N","I"
603,"QUAL É O PLURAL DA PALAVRA KID? ","KID","KIDIES","KIDYS","KIDS","4","A",,"N","I"
583,"OPEN É O CONTRÁRIO DE QUAL PALAVRA?","CLOSE","SIT DOWN","PICK UP","STAND UP","1","A",,"N","I"
584,"A PALAVRA ""CARROT"" CORRESPONDE A QUAL DESSES LEGUMES?","BETERRABA","CENOURA","TOMATE","BATATA","2","A",,"N","I"
585,"QUAL É A COR DO LIMÃO?","GREEN","RED","BLUE","ORANGE","1","A",,"N","I"
586,"A QUAL PEÇA DE ROUPA CORRESPONDE A PALAVRA ""SKIRT""?","BERMUDA","BLUSA","SAIA","CALÇA","3","A",,"N","I"
596,"COMO SE ESCREVE ""LEITE"" EM INGLÊS?","WATER","BEER","JUICE","MILK","4","A",,"N","I"
588,"APPLE PIE É O MESMO QUE:","BOLO DE BANANA","SUCO DE PÊRA","TORTA DE MAÇÃ","SORVETE DE AMORA","3","A",,"N","I"
581,"QUAL DESSES ANIMAIS CORRESPONDE AO COELHO?","RABBIT","CAT ","DOG","BEAR","1","A",,"N","I"
590,"SUMMER CORRESPONDE A QUAL ESTAÇÃO DO ANO?","OUTONO","VERÃO","PRIMAVERA","INVERNO","2","A",,"N","I"
591,"MEIA-NOITE É O MESMO QUE:","MIDWEEK","MIDDAY","MIDNIGHT","MIDWAY","3","A",,"N","I"
592,"QUAL É O SIGNIFICADO DA PALAVRA INGLÊSA ""KING""?","RATO","REI","RAINHA","RÃ","2","A",,"N","I"
593,"HEAVY É UM ADJETIVO QUE CORRESPONDE A:","ÁSPERO","LEVE","PESADO","MACIO","3","A",,"N","I"
594,"QUAL DESSES OBJETOS CORRESPONDE À PALAVRA ""BARCO"" EM INGLÊS?","BOOK","BOAT","BALL","BAG","2","A",,"N","I"
595,"QUAL DESSAS FRUTAS CORRESPONDE AO ABACATE?","ORANGE","APPLE","PEACH","AVOCADO","4","A",,"N","I"
619,"QUAL É A PERGUNTA PARA: ""THEY ARE AT SCHOOL""?","WHERE DO YOU LIVE?","WHERE ARE THEY?","WHERE HAVE YOU BEEN?","WHERE ARE YOU FROM?","2","A",,"N","I"
644,"QUAL É O PARTICÍPIO PASSADO DO VERBO IRREGULAR ""BEGIN""","BEGAN","BECAME","BEGUN","BECOME","3","A",,"N","I"
605,"AVÓ EM INGLÊS CORRESPONDE A:","GRANDMOTHER","UNCLE","AUNT","DAUGHTER","1","A",,"N","I"
631,"GOOD MORNING SIGNIFICA:","ATÉ LOGO","BOA-TARDE","BOA-NOITE","BOM-DIA","4","A",,"N","I"
632,"O QUE SIGNIFICA ""SHE"" EM INGLÊS?","ELE","NÓS","VOCÊS","ELA","4","A",,"N","I"
633,"QUAL DESSAS PALAVRAS SIGNIFICA ÔNIBUS EM INGLÊS?","HORSE","CAR","APPLE","BUS","4","A",,"N","I"
634,"QUAL É A TRADUÇÃO DA PALAVRA INGLESA ""BOOK""?","CANETA","LÁPIS","MESA","LIVRO","4","A",,"N","I"
635,"O QUE SIGNIFICA A PALAVRA ""LOVE"" EM INGLÊS?","AMIGO","AMOR","ANJO","ARMA","2","A",,"N","I"
645,"E-MAIL SIGNIFICA:","INTERNET GRÁTIS","CORREIO ELETRÔNICO","POSTAGEM AUTOMÁTICA","COMÉRCIO ELETRÔNICO","2","A",,"N","I"
637,"O QUE SIGNIFICA ""RED"" EM INGLÊS:","RAMO","RUDE","VERMELHO","REDE","3","A",,"N","I"
629,"RUNAWAY CORRESPONDE A QUAL DESSAS AÇÕES:","CORTAR","GRITAR","FUGIR","LUTAR","3","A",,"N","I"
639,"QUAL É O SIGNIFICADO DA PALAVRA INGLESA ""STOP""?","ATENÇÃO","PARE","SIGA","RETORNE","2","A",,"N","I"
640,"A PALAVRA ""BIG"" EM INGLÊS SIGNIFICA:","GRANDE","PEQUENO","BONITO","PORCO","1","A",,"N","I"
641,"QUAL É O SIGNIFICADO DO VERBO ""TO DO"" NA FRASE: ""I AM DOING MY HOMEWORK.""?","FIZ","FAREI","FARIA","FAZENDO","4","A",,"N","I"
642,"QUAL DESSAS FRASES ESTÁ INCORRETA?","THIS IS A UMBRELLA","THAT TABLE WAS MINE","HE WAS NOT HAPPY","SHE HAS GOT LONG HAIR","1","A",,"N","I"
2460,"WHEN ________ HELP ME ?","YOU SHOULD","DON'T YOU","YOU WILL","COULD YOU","4","B",,"N","I"
2458,"WHAT ___________?","THEY DID","DID THEY","DO THEY DID","DID THEY DO","4","B",,"N","I"
2488,"WHO ________ THE BLAME ON PAUL?","IS PUTING","IS GIVING OFF","IS GIVING","IS PUTTING","4","B",,"N","I"
2447,"WHAT ______________ HER BACK ?","SHOULD  I GIVE","I SHOULD GIVE","SHOULD I COME","SHOULD I GO","1","B",,"N","I"
2448,"WHEN _____________PETER, I'LL GIVE HIM THE BOOK.","WILL I SEE","I CAN SEE","I SEE","I WILL SEE","3","B",,"N","I"
2449,"THE DOG OFTEN _____________ ON MY BED.","LIES","IS LYING","LAY DOWN","LIE","1","B",,"N","I"
2450,"FILL IN THE MISSING WORD. TO ""_____________ AROUND THE BUSH"" IS NA IDIOM WHICH MEANS TO AVOID SPEAKING DIRECTLY.","TALK","RUN","BEAT","LOOK","3","B",,"N","I"
2451,"CHOOSE THE CORRECT ANSWER. ONLY AT NIGHT ____________ THE SAFETY OF THEIR CAVE.","BATS LEAVE","LEAVE BATS","BATS WILL LEAVE","DO BATS LEAVE","1","B",,"N","I"
2452,"WHICH WORD COMPLETES THIS SENTENCES? I'VE BEEN A STUDENT _____________ FIVE YEARS.","FOR","DURING","IN RETAIL PRICE","SINCE","1","B",,"N","I"
2453,"___________________, THERE'S A RAINBOW IN THE SKY!","WATCH","LOOK AT","WATCH UP","LOOK","4","B",,"N","I"
2454,"WHICH PREPOSITION IS CORRECT? SHE'S ALREADY LEFT THE OFFICE BUT YOU CAN PHONE HER ___________ HOME.","AT  ","ON","AT","IN","1","B",,"N","I"
2455,"THE FORMER PRESIDENT_____________ A SPEECH IN PARLIAMENT ON MONDAY.","MADE","DID","TOOK","GOT","1","B",,"N","I"
2456,"WHAT WORD DESCRIBES A PERIOD OF 10 YEARS?","CENTURY","AEON","DECTON","DECADE","4","B",,"N","I"
2457,"HIS WIFE GAVE HIM _________________, WHICH SAVED HIS LIFE.","A TONIC","FIRST AID","SUNBURN","DANDRUFF","2","B",,"N","I"
2474,"I HAVE NEVER _________________ TO HER.","LAY","LAY DOWN","LAID","LIED","4","B",,"N","I"
2459,"SHE _______________ IN  BED ASLEEP WHEN I CALLED.","LIES","LAY DOWN","WAS LYING","LIED","3","B",,"N","I"
2445,"MY GRANDMOTHER'S OVER 90 BUT SHE'S VERY _______________FOR HER AGE.","UNEASY","ACTIVE","TENSE","NERVOUS","2","B",,"N","I"
2461,"WHICH WORD MEANS A PERIOD OF 100 YEARS?","DECADE","ERA","CENTURY","MILLENNIUM","3","B",,"N","I"
2462,"IF YOUR TOOTHACHE CONTINUES, YOU'LL HAVE TO SEE YOUR ____________________","DENTIST","OPTICIAN","VET","SURGEON","1","B",,"N","I"
2463,"I WANT TO TAKE MY TEMPERATURE. WHERE'S THE __________________?","STETHOSCOPE","ANTISEPTIC","THERMOMETER","METER","3","B",,"N","I"
2464,"MY GRANDMOTHER'S A BIT ________________ SO COULD YOU SPEAK A LITTLE LOUDER.","LAME","DUMB","BLIND","DEAF","4","B",,"N","I"
2465,"SHE ________ TO ME YESTERDAY.","LIED","LAID","LAY","LIE","1","B",,"N","I"
2466,"WHICH SENTENCE IS CORRECT?","I WISH IT WILL STOP RAINING","I WISH IT WILL STOP TO RAIN","I WISH IT WOULD STOP RAINING","I WISH IT WOULD STOP TO RAIN","3","B",,"N","I"
2467,"I WILL HAVE A ___________________ WITH THE BOSS.","WORD","SPEAK ","SENTENCE","DIALOGUE","1","B",,"N","I"
2468,"THE CONGRESS OF THE USA CONSISTS OF ________________.","THE SENATE AND THE PRESIDENT","THE FEDERAL COURT SYSTEM","THE HOUSE OF REPRESENTATIVES AND THE SENATE","THE PRESIDENT AND CABINET","3","B",,"N","I"
2469,"I ALWAYS __________________ MONEY.","RUN OUT OF","RUN OUT","GET OUT OF","GET OUT","1","B",,"N","I"
2470,"I ____________________ DOWN IN BED.","LAY","LIED","LAID","LAIN","1","B",,"N","I"
2471,"I MUST ____________________ THE COMPUTER OFF.","HAD SWITCHED","HAVE BEEN SWITCHED","SWITCHED","HAVE SWITCHED","4","B",,"N","I"
2472,"IT SEEMED LIKE AGES SINCE I ____________________ HER.","HAVE LAST SEEN","LAST SAW","HAD LAST SEEN","LAST SEE","3","B",,"N","I"
2506,"I _________________ LONDON BEFORE, BUT I HAD NEVER SEEN THE BIG BEN.","HAVE BEEN TO","HAD BEEN TO","HAD BEEN IN","HAVE BEEN IN","2","B",,"N","I"
2446,"SHE ASKED __________________.","WHAT THE POINT WAS","WHAT WILL BE THE POINT","WHAT'S THE POINT","WHAT SHOULD BE THE POINT","1","B",,"N","I"
2490,"FIND THE WORD THAT DOESN'T BELONG TO THE SENTENCE: ""I HAD NEVER SET FOOT OUT IN A PLACE LIKE THIS""","IN","FOOT","OUT","A","3","B",,"N","I"
2536,"HE ASKED IF WE _________________ TO GO THERE.","WANT","WILL WANT","COULD WANT","WANTED","4","B",,"N","I"
2537,"HE HAS BEEN OPERATED _____________ HIS LEG","IN","FOR","ON","WITH","3","B",,"N","I"
2538,"HE'S ALWAYS ________________ JOKES.","TALKING","SAYING","SPEAKING","TELLING","4","B",,"N","I"
2539,"OUR COMPANY HEADQUARTERS ______________ IN LONDON.","IS","HAS","ARE","HAVE","1","B",,"N","I"
2540,"THE NAME OF THE US NATIONAL ANTHEM IS ____________________.","GOD SAVE THE QUEEN","IN GOD WE TRUST","GOD KEEP OUR LAND GLORIOUS AND FREE","THE STAR SPANGLED BANNER","4","B",,"N","I"
2541,"1 PINT = _________________________.","1/2 GALLON","5/6 GALLON","0,46 LITRES","0,57 LITRES","4","B",,"N","I"
2542,"MY HEART WILL GO ON IS A SONG OF _____________.","CELINE DION","MADONNA","THE OFFSPRING","GUNS´N´ROSES","1","B",,"N","I"
2543,"TO PAY FOR SOMETHING = _____________________.","WITHDRAW CASH","OPEN AN ACCOUNT","FOOT THE BILL","MAKE A DEPOSIT","3","B",,"N","I"
2544,"I´LL COME AT EIGHT, OR ANY OTHER_____________ TIME YOU SUGGEST.","ADEQUATE","SUFFICIENT","SUITABLE","COMPETENT","3","B",,"N","I"
2545,"12TH= __________________.","THE TWELVTH","THE TWELVIETH","THE TWELVETH","THE TWELFTH","4","B",,"N","I"
2546,"I APOLOGIZE_____________ FOR TAKING SO MUCH YOUR TIME.","TALKING","OF","FOR ","MYSELF","4","B",,"N","I"
2547,"I _____________________ YOU BUT IS WAS VERY BUSY.","SHOULD HAVE CALLED","MUST HAVE CALLED","SHOULD CALL","HAD TO CALL","1","B",,"N","I"
2564,"I _________________ TO HIM ON THE PHONE.","SPOKED","SPEAKED","SPOKEN","SPOKE","4","B",,"N","I"
2549,"I MADE ________________ LAST MONTH.","A LOT OF MONEY","SO MANY MONEY","LOTS MONEY","MANY MONEY","1","B",,"N","I"
2535,"I WON'T GO THERE IF IT ___________________ TOMORROW.","RAIN","WOULD RAIN","RAINS","WILL RAIN","3","B",,"N","I"
2551,"COULD YOU LOOK _________________ IT?","TO","ON","WITH   ","AT","4","B",,"N","I"
2552,"I HAVE __________________ IN THIS TEST.","MADE A LOT OF MISTAKES","DONE A LOT OF MISTAKES","MADE A LOT OF FAULTS","DONE A LOT OF FAULTS","1","B",,"N","I"
2553,"I SAW HER ___________.","FOR 2 YEARS","BEFORE 2 YEARS","SINCE 2 YEARS","2 YEARS AGO","4","B",,"N","I"
2554,"SHE SPEAKS ENGLISH VERY WELL _______________ SHE'S BLIND.","IN SPITE OF","ALTHOUGH","DESPITE","THROUGH","2","B",,"N","I"
2555,"I REALISED THAT IF WE _________________ WE COULD BE VERY TIRED.","WILL CONTINUE","WOULD CONTINUE","CONTINUED","CONTINUE","3","B",,"N","I"
2556,"SHE WAS WEARING ___________________ BEAUTIFUL CLOTHES.","SO OLD AS ME","SUCH A","SUCH","A SO","3","B",,"N","I"
2557,"IF SHE WERE MY DAUGHTER, I _________________ HER STOP.","MAKE","WOULD MAKE","WILL MAKE","HAD MADE","2","B",,"N","I"
2558,"HE REMINDS ME _________________ SOMEONE.","WITH","OF","FROM","WITH","2","B",,"N","I"
2559,"THE RACE __________________ IN PRAGUE.","WAS HOLDED","WERE HOLD","WAS HELD","WAS HOLD","3","B",,"N","I"
2560,"I ___________________ THIS TEST FOR 15 MINUTES.","HAVE BEEN DOING","DO","HAVE DONE","AM DOING","1","B",,"N","I"
2561,"I NEVER EXPECTED YOU TO TURN _______________ AT THE MEETING. I THOUGHT YOU WERE ABROAD.","UP","IN","AROUND","WITH","1","B",,"N","I"
2562,"I HAVEN'T READ THE BOOK YET AND BESIDES, I _______________ IT AT HOME.","FORGET","FORGOT","LEFT","LET","3","B",,"N","I"
2563,"TO INVEST= ____________________.","TO SATISFY CUSTOMERS´DESIRE TO PURCHASE","TO SET THINGS IN LINE","TO DEREGULATE","TO LEND MONEY OR PUT MONEY INTO A BUSINESS","4","B",,"N","I"
2520,"WE ___________________ ENGLISH FOR TWO YEARS IN DECEMBER.","WILL HAVE BEEN LEARNING","WILL BE LEARNING","ARE GOING TO LEARN","WILL LEARN","1","B",,"N","I"
2518,"DO YOU SPEAK ENGLISH?","YES, I AM SPEAKING","YES, I DO","YES, I AM","YES, I SPEAK","2","B",,"N","I"
2548,"SKILL = __________________.","THE POWER OF DOING WICH IS THE RESULT OF PRACTISE","ARRANGEMENT","DEGREE OF EXCELLENCE","PRICE TO BE PAID","1","B",,"N","I"
2507," DON´T __________ANY ATTENTION, THEN,  SAID THE FARMER...","TAKE","PAY","PUT","MAKE","2","B",,"N","I"
2508,"..."" THAT WAS ONLY OLD DOBBIN AND HE DOESN´T KNOW A THING ABOUT ________""","MARES","NOSH","CARS","OATS","3","B",,"N","I"
2509,"WHERE ARE YOU FROM?","I'M OF THE CZECH REPUBLIC","I'M FROM THE CZECH REPUBLIC","I'M IN THE CZECH REPUBLIC","I'M OF CZECH REPUBLIC","2","B",,"N","I"
2510,"HOW OLD ARE YOU?","I'M OLD TWENTY-THREE","I'M TWENTY-THREE YEARS","I'M TWENTY-THREE","I HAVE TWENTY-THREE YEARS","3","B",,"N","I"
2511,"WHAT DO YOU DO ?","I'M A STUDENT","I DO STUDENT","I DOING ENGLISH","I'M STUDY ENGLISH","1","B",,"N","I"
2512,"DO YOU LIKE ENGLISH?","YES, I LIKE","YES, I LIKE DO","YES, I'M LIKE","YES, I DO","4","B",,"N","I"
2513,"HE STOPPED THE FARMER AND TOLD HIM EXACTLY WHAT ______________.","HAS HAPPENED","HAPPENED","HAD HAPPENED","WAS GOING TO HAPPEN","3","B",,"N","I"
2514,"DO YOU HAVE ANY CHILDREN?","NO, I HAVE ANY","NO, I DON'T HAVE","NO, NOT","NO, I DON'T","4","B",,"N","I"
2515,"THE MAN WAS SO SURPRISED THAT HE RAN DOWN THE ROAD UNTIL HE MET A FARMER WALKING____HIM","ON","TOWARDS","ASIDE","OUT OF","2","B",,"N","I"
2516,"WHAT COLOR IS YOUR CAR?","IT'S CAR RED","IT RED IS","IS RED","IT'S RED","4","B",,"N","I"
2517,"WHEN DO YOU HAVE DINNER?","IN THE MORNING","AT 11:30","AT 19:30","LAST NIGHT","3","B",,"N","I"
