NUMERO,PERGUNTA,RESP1,RESP2,RESP3,RESP4,CERTA,TIPO,FLAG,JA_FOI,MATERIA
375,"COMO É CHAMADO O APARELHO DESTINADO A CRAVAR ESTACAS NO SOLO?","BATE-FOLHAS","BATEGA","BATE-ESTACAS","BATE-ENXUGA","3","A",,"N","V"
374,"COMO É CHAMADO O AÇÚCAR MASCAVO EM FORMA DE PEQUENOS TIJOLOS?","TIÇÃO","COCADA","PAÇOCA","RAPADURA","4","A",,"N","V"
373,"COMO É CHAMADO O ABRIGO DE LONA UTILIZADO POR SOLDADOS EM CAMPANHA?","CARRETEL","BARRACA","JAMANTA","CAÇAMBA","2","A",,"N","V"
347,"COMO É CHAMADO CADA UM DOS CURTOS PARÁGRAFOS DA BÍBLIA?","SALMO","BLOCO","VERSÍCULO","PARTÍCULA","3","A",,"N","V"
386,"COMO É CHAMADA A MÁQUINA A VAPOR QUE REBOCA VAGÕES DE CARGA?","CARRILHÃO","GUINDASTE","LOCOMOTIVA","TANQUE","3","A",,"N","V"
361,"COMO É CHAMADA UMA PESSOA MUITO ASSÍDUA A FESTAS?","MÃO-DE-VACA","PÉ-DE-CHUMBO","ARROZ-DE-FESTA","PÉ-DE-VALSA","3","A",,"N","V"
337,"COMO É CHAMADA A PARTE DO PORTO UTILIZADA PARA EMBARQUE E DESEMBARQUE?","CAIS","COURAÇA","PROA","LEME","1","A",,"N","V"
336,"COMO É CHAMADA A RUA ESTREITA E CURTA QUE NÃO TEM SAÍDA?","TRAVESSA","BECO","AVENIDA","ALAMEDA","2","A",,"N","V"
335,"COMO É CHAMADA A REFEIÇÃO FORMAL E SOLENE COM MUITOS CONVIDADOS?","BANQUETE","BANCADA","BAGAÇADA","BAGADA","1","A",,"N","V"
334,"COMO É CHAMADA A PREPARAÇÃO CULINÁRIA DE REFOGADOS?","FRIOS","GUISADO","SALADA","FLAMBADO","2","A",,"N","V"
333,"COMO É CHAMADA A PESSOA QUE TRABALHA A MADEIRA?","METALÚRGICO","MARCENEIRO","JARDINEIRO","SERRALHEIRO","2","A",,"N","V"
332,"COMO É CHAMADA A PESSOA QUE LEVA UMA VIDA DESREGRADA?","ESPORTISTA","BOÊMIO","BOATEIRO","BALADOR","2","A",,"N","V"
323,"COMO É CHAMADA A PESSOA QUE ESCREVE O CONTEÚDO DE UMA NOTÍCIA DE JORNAL?","ESCRINO","REDATOR","ESCRITURISTA","REDENTE","2","A",,"N","V"
330,"COMO É CHAMADA A PESSOA QUE ACOMPANHA OUTRA PARA DEFENDÊ-LA DE AGRESSÕES?","GUARDA-PATRÃO","SALVA-VIDAS","SALVA-MÃO","GUARDA-COSTAS","4","A",,"N","V"
338,"COMO É CHAMADO O BONECO QUE SE COLOCA NO CAMPO PARA AFUGENTAR PÁSSAROS?","MÁGICO","ESPANTALHO","TRAPEZISTA","CONTORCIONISTA","2","A",,"N","V"
328,"COMO É CHAMADA UMA PESSOA QUE AMA A PÁTRIA?","PATRIOTO","PATROCÍNIO","PATRIOTA","PATRIMÔNIO","3","A",,"N","V"
327,"COMO SE CHAMA O RECIPIENTE PARA MOLHAR AS PLANTAS?","RADIADOR","REGADOR","GERADOR","SOLDADOR","2","A",,"N","V"
326,"COMO É CHAMADO O LUGAR ONDE OS GLADIADORES LUTAVAM?","PLATÉIA","ARENA","PRAÇA","RINQUE","2","A",,"N","V"
325,"COMO TAMBÉM É CONHECIDA A FRUTA-DE-CONDE?","PINHA","MAÇÃ","BANANA","LARANJA","1","A",,"N","V"
345,"COMO TAMBÉM É CONHECIDA A ANTA?","PORCO","TUBARÃO","ONÇA","TAPIR","4","A",,"N","V"
329,"COMO SE INICIA UM JOGO DE VÔLEI?","CORTADA","SAQUE","CESTA","TOQUE","2","A",,"N","V"
331,"COMO SE CHAMOU A INSTRUÇÃO RELIGIOSA DADA PELOS PADRES AOS ÍNDIOS?","CATEQUESE","SACRAMENTO","OFERTÓRIO","EUCARISTIA","1","A",,"N","V"
353,"COMO SE CHAMA UMA DISPUTA EM QUE O VENCEDOR RECEBE O TÍTULO DE CAMPEÃO?","CAMPEVA","CAMPEONATO","CAMPESTRE","CAMPÃO","2","A",,"N","V"
352,"COMO SE CHAMA UM VELOCÍPEDE DE APENAS UMA RODA?","MOTOCICLETA","MONOCICLO","BICICLETA","TRICICLO","2","A",,"N","V"
351,"CAPELETE E TALHARIM SÃO ALGUNS EXEMPLOS DE:","VINHOS","LEGUMES","MASSAS","QUEIJOS","3","A",,"N","V"
350,"COMO SE CHAMA O SAPATO UTILIZADO PELOS BAILARINOS?","SAPATILHO","SAPATILHA","SAPATEIRO","SAPATINHA","2","A",,"N","V"
349,"CRUZEIROS SÃO VIAGENS FEITAS DE:","NAVIO","AVIÃO","TREM","ÔNIBUS","1","A",,"N","V"
348,"COMO SE CHAMA O PROFISSIONAL QUE CONSERTA E VENDE PNEUS?","ENCANADOR","MARCENEIRO","BORRACHEIRO","PEDREIRO","3","A",,"N","V"
339,"COMO SE CHAMA O PASSEIO NO CAMPO ONDE CADA PESSOA LEVA SUA REFEIÇÃO?","PIQUENIQUE","RODA-VIVA","ESCONDE-ESCONDE","QUEIMADA","1","A",,"N","V"
346,"COMO SE CHAMA O LOCAL ONDE SE RECOLHE OS CAVALOS?","GALINHEIRO","ESTÁBULO","POCILGA","CHIQUEIRO","2","A",,"N","V"
354,"COMO SE CHAMA O LOCAL ONDE OS ATORES SE VESTEM E SE PINTAM?","CAMAROTE","PALCO","AUDITÓRIO","CAMARIM","4","A",,"N","V"
344,"COMO SE CHAMA O ESTOJO QUE CONTÉM A CARGA DE UMA ARMA DE FOGO?","CARTILHA","CARTUCHO","CARTILAGEM","CARTOLINA","2","A",,"N","V"
343,"COMO SE CHAMA O EPISÓDIO DE LIBERTAÇÃO DOS ESCRAVOS NO BRASIL?","DITADURA","ABOLIÇÃO","DEMOCRACIA","MONARQUIA","2","A",,"N","V"
342,"COMO SE CHAMA O DONO DE UM BANCO?","BANQUETEIRO","BANQUETEADOR","BANQUEIRO","BANCÁRIO","3","A",,"N","V"
341,"COMO SE CHAMA O VIDRO FIXO COLOCADO NA PARTE DIANTEIRA DO CARRO?","CALOTA","PÁRA-BRISA","CAPÔ","PÁRA-CHOQUE","2","A",,"N","V"
340,"DE QUE COR É A CAMISA DO URSINHO POOH DA DISNEY?","PRETA","VERMELHA","AZUL","MARROM","2","A",,"N","V"
439,"QUAL É A COR DA NOTA DE UM REAL?","ROSA","VERDE","AZUL","VERMELHA","2","A",,"N","V"
363,"DEPOIS DO CASAMENTO, O QUE A NOIVA JOGA PARA AS CONVIDADAS SOLTEIRAS?","VESTIDO","BUQUÊ","GRINALDA","VÉU","2","A",,"N","V"
452,"DENTAL É RELATIVO A QUÊ?","OUVIDO","DENTE","OLHO","NARIZ","2","A",,"N","V"
461,"DECLIVE ESTÁ RELACIONADO A QUÊ?","DESCIDA","SUBIDA","TOMBO","CORRIDA","1","A",,"N","V"
462,"DE QUE ERAM FEITOS OS SAPATOS DA CINDERELA?","COURO","CRISTAL","SEDA","PORCELANA","1","A",,"N","V"
463,"DE QUE É FEITO O PÉ-DE-MOLEQUE?","AMENDOIM","CASTANHA","ALCAPARRA","ABACATE","1","A",,"N","V"
464,"DE QUE É FEITO O ""BAIÃO-DE-DOIS""?","ARROZ E FEIJÃO","BATATA E CARNE-SECA","FAROFA E FRANGO","MACARRÃO E FRANGO","1","A",,"N","V"
465,"CONFORME A BÍBLIA, EM QUE DIA DEUS CRIOU O HOMEM?","TERCEIRO DIA","PRIMEIRO DIA","SEXTO DIA","QUINTO DIA","3","A",,"N","V"
466,"DE QUE COR É A PEDRA AMETISTA?","AMARELA","VERMELHA","ROXA","VERDE","3","A",,"N","V"
490,"COMO SE CHAMA O CORDÃO COM O QUAL SE AMARRAM OS SAPATOS?","CARDAÇO","CARDARÇO","CADARÇO","CADAÇO","3","A",,"N","V"
515,"DE QUANTO EM QUANTO TEMPO É REALIZADA A COPA DO MUNDO DE FUTEBOL?","CADA 3 ANOS","CADA 4 ANOS","CADA 2 ANOS","CADA 5 ANOS","2","A",,"N","V"
476,"DE QUAL DESSES ANIMAIS É RETIRADA A LÃ?","PANDA","OVELHA","BOI","CACHORRO","2","A",,"N","V"
502,"DE QUAL BANDA RENATO RUSSO ERA VOCALISTA?","PARALAMAS DO SUCESSO","TITÃS","MAMONAS ASSASSINAS","LEGIÃO URBANA","4","A",,"N","V"
503,"DE ONDE, NORMALMENTE, O MÁGICO TIRA O COELHO?","BONÉ","CHAPÉU","VISEIRA","CARTOLA","4","A",,"N","V"
504,"DE ONDE VÊM AS PÉROLAS?","TUBARÕES","LAGOSTAS","PEDRAS MARÍTIMAS","OSTRAS","4","A",,"N","V"
505,"DAVID COPPERFIELD É UM FAMOSO...","MAQUINISTA","CIENTISTA","TELEFONISTA","ILUSIONISTA","4","A",,"N","V"
506,"DÁLMATA É UMA RAÇA DE QUAL ANIMAL?","GATO","CACHORRO","CAVALO","URSO","2","A",,"N","V"
516,"DE QUE COR É O SORVETE DE PISTACHE?","AMARELO","ROSA","VERDE","AZUL","3","A",,"N","V"
508,"COMO É CHAMADO O OBJETO OFERECIDO DE PRESENTE?","PENALIZAÇÃO","APÓLICE","BRINDE","TÍTULO","3","A",,"N","V"
500,"COMO SE CHAMA A COBERTURA DE BOLO À BASE DE AÇÚCAR DISSOLVIDO?","PALHOÇA","GLACÊ","QUENTÃO","AMÊNDOA","2","A",,"N","V"
510,"COMO SE CHAMA A CHAVE USADA POR ENCANADORES?","FRANCESA","ESPANHOLA","ALEMÃ","INGLESA","4","A",,"N","V"
511,"COMO SE CHAMA A CELA DA PENITENCIÁRIA ONDE SE ISOLA UM PRESO?","SOLITÁRIA","PERMANÊNCIA","UNITÁRIA","COFRE","1","A",,"N","V"
512,"COMO SE CHAMA A ATIVIDADE DE COMPRA E VENDA?","RECREAÇÃO","DOAÇÃO","EMPRÉSTIMO","COMÉRCIO","4","A",,"N","V"
514,"COMO SE CHAMA A ARMAÇÃO EM QUE OS OPERÁRIOS TRABALHAM NAS CONSTRUÇÕES?","ANÁBASE","ANACÃ","ANDAIME","ANACO","3","A",,"N","V"
509,"COMO SE CHAMA A ARGOLA QUE FICA SOBRE A CABEÇA DOS SANTOS?","CHAPÉU","AURA","CAPACETE","AURÉOLA","4","A",,"N","V"
507,"COMO SE CHAMA A ÁREA DO CAMPO DE BASQUETE DEBAIXO DA TABELA?","GARRAFÃO","MEIO-DE-CAMPO","ÁREA NOBRE","ZONA CEGA","1","A",,"N","V"
485,"COMO SE CHAMA O DESENHO ARTÍSTICO FEITO NA PELE:","CARTONAGEM","TATUAGEM","QUADRINIZAÇÃO","DRENAGEM","2","A",,"N","V"
486,"COMO SÃO CLASSIFICADOS OS ANIMAIS QUE TÊM MAMA?","MAMÍFEROS","ANFÍBIOS","RÉPTEIS","INSETOS","1","A",,"N","V"
487,"COMO SE CHAMA A EXPEDIÇÃO DE CAÇA NAS SELVAS AFRICANAS?","SAFÁRI","SAVANA","ROMARIA","PASSEIO","1","A",,"N","V"
488,"COMO É CHAMADO O ABRIGO PARA AUTOMÓVEIS?","GARAGEM","HELIPORTO","SÓTÃO","ALFÂNDEGA","1","A",,"N","V"
489,"COMO SÃO CHAMADOS OS FUNCIONÁRIOS DOS BANCOS?","SECRETÁRIOS","BANCÁRIOS","ESCREVENTES","TABELIÃES","2","A",,"N","V"
499,"COMO SÃO CHAMADAS AS PESSOAS QUE NAVEGAM NA INTERNET?","INTERNETOS","INTERNAUTAS","INTERNÉTICOS","INTERNETADORES","2","A",,"N","V"
491,"COMO SÃO CHAMADAS AS MANCHINHAS QUE APARECEM NO ROSTO DAS PESSOAS?","ESPINHAS","SARDAS","CACHOS","COVINHA","2","A",,"N","V"
484,"COMO SÃO CHAMADAS AS CASINHAS DESTINADAS AO ABRIGO DOS SENTINELAS?","SERESTA","GUARITA","SERENATA","GARUPA","2","A",,"N","V"
493,"COMO É CHAMADA A BOLINHA DE VIDRO DAS BRINCADEIRAS DE CRIANÇA?","BOLINHA DE AÇÚCAR","BOLINHA DE ARROZ","BOLINHA DE GUDE","BOLINHA DE SOL","3","A",,"N","V"
494,"COMO PODE SER CHAMADO O SERTANEJO QUE FOGE DA SECA?","RETIRANTE","SENDEIRO","REINANTE","SEDENTÁRIO","1","A",,"N","V"
495,"O AERÓSTATO QUE USA UM GÁS MAIS LEVE QUE O AR E QUE NÃO UTILIZA MOTOR É O...","HELICÓPTERO","BALÃO","AVIÃO","SUBMARINO","2","A",,"N","V"
496,"COMO SE CHAMA A PESSOA MUITO PARECIDA COM A OUTRA?","CLONE","SÓSIA","RÉPLICA","SINÔNIMO","2","A",,"N","V"
497,"CATATAU FAZ PARTE DE QUAL TURMA DE DESENHO ANIMADO?","PERNALONGA","ZÉ COLMÉIA","PICA-PAU","MÔNICA","2","A",,"N","V"
444,"COMO SE CHAMA O CALÇADO DE BORRACHA QUE OS NADADORES ADAPTAM AOS PÉS?","PÉ-DE-GALO","PÉ-DE-PAVÃO","PÉ-DE-PAU","PÉ-DE-PATO","4","A",,"N","V"
501,"COMO SE CHAMAM OS CABELOS QUE TÊM CACHOS?","CACHOPAS","CACHEADOS","EMBOLADOS","CACHOADOS","2","A",,"N","V"
453,"COMO SE CHAMA O ATO DE SE EXPRESSAR ATRAVÉS DE GESTOS?","BRAILE","MÍMICA","MORFOLOGIA","CALIGRAFIA","2","A",,"N","V"
405,"COMO SE CHAMA O ASTRO QUE NOS FORNECE CALOR?","COMBUSTÃO","ATRITO","SOL","ELETRICIDADE","3","A",,"N","V"
406,"COMO SE CHAMA O ARMAZÉM ONDE SÃO GUARDADOS VINHOS EM CONDIÇÕES ADEQUADAS?","SÓTÃO","PORÃO","VINHAÇA","ADEGA","4","A",,"N","V"
407,"COMO SE CHAMA A VESTIMENTA PRETA USADA POR UM FORMANDO DE CURSO SUPERIOR?","BREVÊ","BECO","BEDEL","BECA","4","A",,"N","V"
408,"COMO SE CHAMA A DISPUTA EM QUE O VENCEDOR RECEBE O TÍTULO DE CAMPEÃO?","CAMPEVA","CAMPEONATO","CAMPESTRE","CAMPÃO","2","A",,"N","V"
409,"COMO SE CHAMA A PLATAFORMA ONDE O ATLETA RECEBE O TROFÉU?","PALCO","ALTAR","PÓDIO","PALANQUE","3","A",,"N","V"
419,"COMO SE CHAMA A ESTRUTURA DA CAMA ONDE SE ASSENTA O COLCHÃO?","ENVERGADURA","ESTRADO","HASTE","CABECEIRA","2","A",,"N","V"
411,"COMO SE CHAMA A PEÇA DE COURO OU DE METAL QUE CERCA O PESCOÇO DOS ANIMAIS?","SELA","FOCINHEIRA","BAIA","COLEIRA","4","A",,"N","V"
404,"COMO SE CHAMA A PARTE SONORA DE UM FILME?","CENA","TRAILER","TRILHA SONORA","SET","3","A",,"N","V"
413,"COMO SE CHAMA A ESPIGA DE MILHO SEM OS GRÃOS?","SABUGO","JOIO","SEMENTE","CAROÇO","1","A",,"N","V"
414,"COMO SE CHAMA A PARTE DO TREM QUE É REBOCADA?","ALÇAPÃO","LOCOMOTIVA","VAGÃO","ABRIGO","3","A",,"N","V"
415,"COMO SE CHAMA A MANJEDOURA ONDE O MENINO JESUS FOI POSTO AO NASCER?","PRESÉPIO","ADORNO","TRAPÉZIO","FANTOCHE","1","A",,"N","V"
416,"COMO SE CHAMA A GRATIFICAÇÃO EM DINHEIRO POR UM PEQUENO SERVIÇO?","GORJEIO","GORJETA","GORÓ","GORGULHO","2","A",,"N","V"
417,"COMO SE CHAMA A GINÁSTICA FEITA NA ÁGUA?","GINANDRARQUIA","HIDROGINÁSTICA","MESOGINÁSTICA","ENDOGINÁSTICA","2","A",,"N","V"
418,"COMO SE CHAMA O DESENHISTA DE DESENHOS ANIMADOS?","FERREIRO","CARTUNISTA","FIGURINISTA","POETA","2","A",,"N","V"
396,"COMO SE CHAMA A SEÇÃO DE COMPRA E VENDA DOS JORNAIS?","ENTRETENIMENTO","CLASSIFICADOS","ESPORTIVA","EDITORIAL","2","A",,"N","V"
394,"A BARRA SITUADA NA PARTE INFERIOR DA PAREDE, JUNTO AO PISO, CHAMA-SE:","ROLHA","ROLETE","RODADOR","RODAPÉ","4","A",,"N","V"
410,"CHOFER É O OUTRO NOME DADO AO:","MOTORISTA","COZINHEIRO","GARÇOM","ALFAIATE","1","A",,"N","V"
996,"MODA-DE-VIOLA É:","VESTIDO","MÚSICA RURAL","DANÇA","ESTADO","2","A",,"N","V"
1110,"AMERICAN PIT BULL TERRIER É UMA RAÇA DE:","CACHORRO","GATO","CAVALO","OVELHA","1","A",,"N","V"
1725,"QUAL É O SIGNIFICADO DA EXPRESSÃO ESPANHOLA ""BUENAS NOCHES""?","BOA-TARDE","OLÁ","BOA-NOITE","BOM-DIA","3","A",,"N","V"
1724,"DO QUE É FEITO O CURAU?","MILHO","BATATA","SOJA","TRIGO","1","A",,"N","V"
1723,"A BÓIA É UM OBJETO GERALMENTE UTILIZADO NA APRENDIZAGEM DE QUAL MODALIDADE ESPORTIVA?","NATAÇÃO","CICLISMO","HIPISMO","ALPINISMO","1","A",,"N","V"
1722,"ABARROTADO É O MESMO QUE:","ENTORNADO","DERRAMADO","CHEIO","VAZIO","3","A",,"N","V"
1721,"TITÃS É UMA BANDA DE QUAL PAÍS?","ESTADOS UNIDOS","BRASIL","JAMAICA","ITÁLIA","2","A",,"N","V"
1720,"AMOR MATERNO É AMOR DE:","IRMÃ","MÃE","TIA","AVÓ","2","A",,"N","V"
1719,"AMOR DE PAI É...","AMOR FRATERNOPAIZÃO","AMOR PATERNO","AMOR PAIZAL","AMOR PAPAL","2","A",,"N","V"
1705,"ALGO PREMATURO INDICA SER:","PRECOCE","PRODUTIVO","ÍNGREME","ATRASADO","1","A",,"N","V"
1717,"ALFRED HITCHCOCK FICOU CONHECIDO POR SEUS FILMES DE QUÊ?","DRAMA","ROMANCE","COMÉDIA","SUSPENSE","4","A",,"N","V"
1729,"ALCATRA É UM TIPO DE:","DOCE","PEIXE","FRUTA","CARNE","4","A",,"N","V"
1715,"ADOÇADO É O MESMO QUE:","ADORNADO","COM AÇÚCAR","ENCOSTADO","COM ENDOSSO","2","A",,"N","V"
1714,"ANEDOTA É UMA:","TARIFA","FRUTA","PIADA","BEBIDA","3","A",,"N","V"
1713,"ABRIR A BOCA EM SINAL DE TÉDIO SIGNIFICA:","ENGOLIR","SOLUÇAR","BOCEJAR","MORDER","3","A",,"N","V"
1712,"ANOITECER DERIVA DE QUAL PALAVRA?","SOL","NOITE","DIA","LUA","2","A",,"N","V"
1711,"A TROPA MILITAR QUE FAZ SERVIÇO A PÉ É CHAMADA DE...","INFANTARIA","CAVALARIA","AERONÁUTICA","MARINHA","1","A",,"N","V"
1710,"A TIRA DE TECIDO ESTREITA E LONGA AMARRADA COM UM NÓ EM VOLTA DO PESCOÇO É A:","CINTA","PRESILHA","GRAVATA","MANGA","3","A",,"N","V"
1709,"A TENTATIVA DE SE APROXIMAR DE ALGUÉM COM ITENÇÕES AMOROSAS É CHAMADA DE:","ROMANEIO","AMOREIRA","PAQUERA","GALANTINA","3","A",,"N","V"
1708,"A TEMPERATURA MAIS QUENTE DO CHUVEIRO SE ENCONTRA NO SÍMBOLO DE:","PRIMAVERA","INVERNO","VERÃO","OUTONO","2","A",,"N","V"
1707,"A SIGLA DO ORGÃO GOVERNAMENTAL QUE DEFENDE OS DIREITOS DO CONSUMIDOR É:","SENAI","INSS","PROCON","SENAC","3","A",,"N","V"
1706,"A REUNIÃO DE AMIGAS PARA DAR PRESENTES A UMA NOIVA CHAMA-SE:","CHÁ-DE-NOIVA","CHÁ-DE-PANELA","CHÁ-DE-BEBÊ","CHÁ-DE-CASA","2","A",,"N","V"
1668,"A RESIDÊNCIA DE UMA FAMÍLIA NOBRE GERALMENTE É:","UM CASEBRE","UM PALÁCIO","UMA CHOUPANA","UMA PENSÃO","2","A",,"N","V"
1631,"ACÉM É CARNE DE QUAL ANIMAL?","PORCO","CAVALO","BOI","CABRA","3","A",,"N","V"
1681,"AS OLIMPÍADAS SÃO REALIZADAS A CADA:","3 ANOS","5 ANOS","4 ANOS","2 ANOS","3","A",,"N","V"
1652,"CASAS, APARTAMENTOS E TERRENOS SÃO TIPOS DE:","BENS MOBILIÁRIOS","BENS LÍQUIDOS","BENS ABSTRATOS","BENS IMOBILIÁRIOS","4","A",,"N","V"
1651,"CANINO, INCISIVO E MOLAR SÃO:","ANIMAIS","DOCES","FERRAMENTAS","DENTES","4","A",,"N","V"
1650,"CALOURO É UM...","RAPAZ LOURO","TIRANO","TARIMBADO","PRINCIPIANTE","4","A",,"N","V"
1649,"CAÇAMBA É:","UMA FLOR","UMA BEBIDA","UM CACHIMBO","UM BALDE","4","A",,"N","V"
1648,"BOTECO É UMA EXPRESSÃO POPULAR UTILIZADA PARA:","PADARIA","SUPERMERCADO","AÇOUGUE","BAR","4","A",,"N","V"
1647,"BARCELONA É UM TIME DE FUTEBOL DE QUAL PAÍS?","CUBA","ESPANHA","ITÁLIA","MÉXICO","2","A",,"N","V"
1646,"BANHO-MARIA É O COZIMENTO CUJO RECIPIENTE É COLOCADO EM ÁGUA:","FRIA","FERVENTE","GELADA","DESTILADA","2","A",,"N","V"
1645,"ANCA É O MESMO QUE:","PESCOÇO","MÃO","QUADRIL","BARRIGA","3","A",,"N","V"
1644,"A AVE UTILIZADA PARA TRANSPORTE DE CORRESPONDÊNCIAS É O:","GALO-FAX","PATO-MENSAGEIRO","GANSO-CARTA","POMBO-CORREIO","4","A",,"N","V"
1630,"A QUE LINHA PERTENCE A TOALHA DE PRAIA?","CAMA","MESA","BANHO","COZINHA","3","A",,"N","V"
1640,"ARRASTA-PÉ É O MESMO QUE:","BAILE","ESPORTE","GINÁSTICA","LUTA","1","A",,"N","V"
1639,"AQUILO QUE É DESTITUÍDO DE FORMALIDADES É CHAMADO DE:","ELEGANTE","INFORMAL","CHIQUE","DISTINTO","2","A",,"N","V"
1638,"AQUELE QUE SE PREOCUPA COM O MEIO AMBIENTE EM RELAÇÃO AOS SERES VIVOS É UM:","SERTANISTA","ECOLOGISTA","ALPINISTA","FUNDISTA","2","A",,"N","V"
1637,"AQUELE QUE É PROPENSO A EMOÇÕES É:","EMIRADO","EMISSIVO","EMOTIVO","EMITENTE","3","A",,"N","V"
1636,"AQUELE QUE COME MUITO E COM VORACIDADE É CHAMADO DE:","GUTAÇÃO","GLÚTEN","GLUTÃO","GLUTINA","3","A",,"N","V"
1635,"QUAL APARELHO É USADO PARA LEVANTAR GRANDES PESOS?","PRENSA","TORNO","GUINDASTE","SOLDA","3","A",,"N","V"
1634,"DANIEL FAZIA DUPLA SERTANEJA COM QUAL CANTOR?","LEONARDO","JOÃO PAULO","ZEZÉ DI CAMARGO","PAULO RICARDO","2","A",,"N","V"
1633,"BALANÇA É SÍMBOLO DE QUAL SIGNO DO ZODÍACO?","VIRGEM","LIBRA","CAPRICÓRNIO","ÁRIES","2","A",,"N","V"
1632,"A EXPRESSÃO XEQUE-MATE É USADA EM QUAL JOGO?","DOMINÓ","BARALHO","SINUCA","XADREZ","4","A",,"N","V"
1666,"A MODA É A ARTE E TÉCNICA DO:","SOM","JOGO","VESTUÁRIO","SONO","3","A",,"N","V"
1752,"A MARMELADA É UM DOCE FEITO DE:","MORANGO","MARMELO","GOIABA","MAÇÃ","2","A",,"N","V"
1641,"A MAIS FAMOSA FESTA DE RODEIO BRASILEIRA É REALIZADA NA CIDADE DE:","BARRETOS","ARACAJU","RECIFE","AMERICANA","1","A",,"N","V"
1718,"A MÃE DA MINHA AVÓ É O QUE DA MINHA MÃE?","TIA","AVÓ","BISAVÓ","TIA-AVÓ","2","A",,"N","V"
1643,"A LOJA QUE FICA ABERTA 24 HORAS E OFERECE VÁRIOS PRODUTOS É A LOJA DE?","CONVENIÊNCIAS","MIUDEZAS","CONVIVÊNCIAS","MODAS","1","A",,"N","V"
1678,"A LETRA MAL FEITA E TORTUOSA É O MESMO QUE:","GARRANCHO","GARUPA","GARGALO","GARAPA","1","A",,"N","V"
1677,"A IRMÃ DA SUA TIA QUE NÃO É SUA TIA É A SUA...","MADRINHA","PRIMA","ENTEADA","MÃE","4","A",,"N","V"
1676,"A REPETIÇÃO DE PALAVRAS PODE SER CHAMADA DE:","MAIS","BIS","MENOS","BASTANTE","2","A",,"N","V"
1675,"A FILHA DA MINHA MÃE É O QUE MINHA?","TIA","SOBRINHA","IRMÃ","PRIMA","3","A",,"N","V"
1674,"A MULHER QUE SE PREPARA PARA FAZER VOTOS NUM CONVENTO CHAMA-SE:","NOVIÇA","MONJA","MADRE","FREIRA","1","A",,"N","V"
1673,"A ENTRADA ESTREITA DA GARRAFA POR ONDE PASSAM OS LÍQUIDOS É CHAMADO DE:","GALOCHA","GARGANTILHA","GARGALO","GALOPE","3","A",,"N","V"
1672,"A DANÇA TARANTELA É TÍPICA DE QUAL PAÍS?","MÉXICO","ITÁLIA","PORTUGAL","ESPANHA","2","A",,"N","V"
1671,"A CRUZ VERMELHA TRATA-SE DE:","IGREJA CATÓLICA","BANCO SUÍÇO","RELÍQUIA ROMANA","AJUDA INTERNACIONAL","4","A",,"N","V"
1670,"A COMPOSIÇÃO MUSICAL REALIZADA SOMENTE POR DUAS VOZES CHAMA-SE:","DUETO","CORAL","SEXTETO","ORQUESTRA","1","A",,"N","V"
1669,"A CIDADE DE VARGINHA FICOU FAMOSA PELO SUPOSTO APARECIMENTO DE QUÊ?","DINOSSAURO","EXTRATERRESTRE","NÔMADE","PIRATA","2","A",,"N","V"
1655,"A CAUSA DOS CRIMES PASSIONAIS É:","DÍVIDA","ROUBO","TRÁFICO","PAIXÃO","4","A",,"N","V"
1667,"A CANOAGEM USA QUAL TIPO DE EMBARCAÇÃO?","CARAVELA","JET-SKI","LANCHA","CANOA","4","A",,"N","V"
1679,"A FRITURA DE UMA FATIA DE PÃO EMBEBIDA EM LEITE E OVOS CHAMA-SE:","TORRADA","RABADA","TORRESMO","RABANADA","4","A",,"N","V"
1665,"A PARTE GORDA DO LEITE CHAMA-SE:","QUEIJO","NATA","CARQUEJA","ÁGUA","2","A",,"N","V"
1664,"QUAL É O ESTADO DE ORIGEM DA LENDA POPULAR DO ""NEGRINHO DO PASTOREIO""?","RIO GRANDE DO SUL","SÃO PAULO","PERNAMBUCO","SERGIPE","1","A",,"N","V"
1663,"A PESSOA QUE POSSUI A TENDÊNCIA DE VER AS COISAS PELO LADO BOM É CHAMADA DE:","PESSIMISTA","ATEU","DESCRENTE","OTIMISTA","4","A",,"N","V"
1662,"A PESSOA QUE NÃO PERTENCE À CLASSE MILITAR É CHAMADA DE:","SOLDADO","CORONEL","MARECHAL","CIVIL","4","A",,"N","V"
1661,"A PESSOA QUE ANDA A PÉ PELAS RUAS DA CIDADE É CHAMADA DE:","CONDUTOR","PEDESTAL","PEDICURO","PEDESTRE","4","A",,"N","V"
1660,"A PEDIDO DE QUAL PRESIDENTE O FUSCA VOLTOU A SER FABRICADO EM 1993?","FERNANDO COLLOR","ITAMAR FRANCO","JOÃO FIGUEIREDO","FERNANDO HENRIQUE","2","A",,"N","V"
1659,"A PEÇA SANITÁRIA UTILIZADA PARA BANHOS DE IMERSÃO CHAMA-SE:","BIDÊ","PIA","BANHEIRA","LATRINA","3","A",,"N","V"
1658,"A MULHER DO SEU PAI QUE NÃO É SUA MÃE É SUA...","MADRASTA","NORA","TIA","MADRINHA","1","A",,"N","V"
1657,"A PÁSCOA MARCA O FIM...","DAS FÉRIAS","DA QUARESMA","DO CARNAVAL","DO NATAL","2","A",,"N","V"
1656,"A MULHER MUITO DEVOTA É:","MAJESTOSA","SANSEI","BEATA","SOPRANO","3","A",,"N","V"
1653,"A PAPA FEITA DE FARINHA, LEITE E AÇÚCAR INDICADA PARA BEBÊS CHAMA-SE:","GEMADA","PURÊ","MINGAU","COALHADA","3","A",,"N","V"
1754,"A PAMONHA É FEITA DE QUÊ?","BATATA","TRIGO","ARROZ","MILHO","4","A",,"N","V"
1808,"A PALAVRA MOLÉSTIA É SINÔNIMO DE:","PREGUIÇA","SONO","DOENÇA","SAÚDE","3","A",,"N","V"
1809,"A PALAVRA MIRIM SIGNIFICA:","PEQUENO","GRANDE","MEDIANO","GORDO","1","A",,"N","V"
1810,"A PALAVRA DEGELAR É MESMO QUE:","CONGELAR","RESFRIAR","DESCONGELAR","GELAR","3","A",,"N","V"
1811,"A PALAVRA CELESTIAL REFERE-SE A:","FOGO","CÉU","AR","TERRA","2","A",,"N","V"
1812,"A PALAVRA BOLOR RELACIONA-SE A ALGO:","RECENTE","VELHO","NOVO","FRESCO","2","A",,"N","V"
1813,"A QUE MOVIMENTO MUSICAL PERTENCEU O CANTOR ROBERTO CARLOS NOS ANOS 60?","JOVEM GUARDA","FUNK","AXÉ","BOSSA-NOVA","1","A",,"N","V"
1823,"A PEÇA DE METAL PERFURADA QUE TEM O NOME DA FÊMEA DE UM ANIMAL É CHAMADA DE:","ARARA","MACACO","TARTARUGA","PORCA","4","A",,"N","V"
1815,"QUAL É O CÓDIGO DDD DA CIDADE DE SÃO PAULO?","13","24","32","11","4","A",,"N","V"
1807,"QUAL É A BEBIDA QUE DIZEM QUE QUANTO MAIS VELHA, MELHOR?","VINHO","CERVEJA","REFRIGERANTE","LEITE","1","A",,"N","V"
1817,"TARANTELA É UMA DANÇA:","ITALIANA","ESPANHOLA","PORTUGUESA","ALEMÃ","1","A",,"N","V"
1818,"SAÚVA ESTÁ RELACIONADO COM:","MANIFESTAÇÃO","FORMIGA","DANÇA","SAUDAÇÃO","2","A",,"N","V"
1819,"UM EDIFÍCIO DE MUITOS PAVIMENTOS É CHAMADO DE:","ARRANHA-NUVEM","ARRANHA-CÉU","ARRANHA-TERRA","ARRANHA-AR","2","A",,"N","V"
1820,"UM DOS MILAGRES DE JESUS CRISTO FOI TRANSFORMAR A ÁGUA EM QUÊ?","SUCO","LEITE","AZEITE","VINHO","4","A",,"N","V"
1821,"UM EDIFÍCIO COM MUITAS DIVISÕES, ONDE É DIFÍCIL ENCONTRAR A SAÍDA, É CHAMADO DE:","MUSEU","BIBLIOTECA","LABIRINTO","PINACOTECA","3","A",,"N","V"
1799,"UM ANIMAL ARISCO NÃO É:","ARREDIO","SELVAGEM","MANSO","BRAVO","3","A",,"N","V"
1816,"UM ACESSÓRIO PARA OS MERGULHADORES É:","PATA-DA-COBRA","PÉ-DE-CABRA","PÉ-DE-PATO","PÉ-DE-FERRO","3","A",,"N","V"
1814,"TUBA É...","UMA COMIDA","UMA BEBIDA","UM INSTRUMENTO MUSICAL","UM TUBARÃO","3","A",,"N","V"
1792,"TRIVIAL É O MESMO QUE:","DESCONHECIDO","COMUM","NOVO","INCOMUM","2","A",,"N","V"
1793,"TRADICIONALMENTE, A COLOMBINA É COMPANHEIRA DE QUAL PERSONAGEM CARNAVALESCO?","ZÉ CARIOCA","PIERRÔ","COCHEIRA","ZÉ-PEREIRA","2","A",,"N","V"
1794,"TOLICE É O MESMO QUE?","PRUDÊNCIA","SENSATEZ","ASNEIRA","DISCRIÇÃO","3","A",,"N","V"
1795,"UM INDÍVIDUO QUE SE QUEIXA DE TUDO É:","RABUDO","SOCIÁVEL","ALEGRE","RABUGENTO","4","A",,"N","V"
1827,"TARÂNTULA É UMA ESPÉCIE DE QUÊ?","COBRA","ESCORPIÃO","BARATA","ARANHA","4","A",,"N","V"
1796,"UM REGENTE DE ORQUESTRA É CHAMADO DE:","ESCULTOR","MAESTRO","PINTOR","CORTEJADOR","2","A",,"N","V"
1822,"SUPERCÍLIO É O MESMO QUE:","MÃO","PUNHO","SOBRANCELHAS","MAQUIAGEM","3","A",,"N","V"
1806,"SOVINA É O MESMO QUE:","BONDOSO","AVARENTO","TRISTE","ALEGRE","2","A",,"N","V"
1798,"SOPHIA LOREN SE DESTACOU COMO O QUÊ?","ARQUITETA","MÉDICA","ATRIZ","DITADORA","3","A",,"N","V"
1791,"SOBRE O QUE DESLIZAM OS TRENS?","TRILHOS","MASTROS","TORRES","CALÇADAS","1","A",,"N","V"
1800,"SEGUNDO A SUPERSTIÇÃO, QUEM PASSAR EMBAIXO DE UMA ESCADA TERÁ:","DOR DE CABEÇA","SAÚDE","CORAGEM","AZAR","4","A",,"N","V"
1801,"SEGUNDO A SÁTIRA POPULAR: ""QUEM NÃO COLA...""","USA CLIPES","NÃO ESTUDOU","NÃO SAI DA ESCOLA","É INTELIGENTE","3","A",,"N","V"
1802,"SEGUNDO A LENDA, EM QUE ANIMAL OS VAMPIROS SE TRANSFORMAM?","RATOS","MORCEGOS","MACACOS","BORBOLETAS","2","A",,"N","V"
1803,"SEGUNDO A HISTÓRIA INFANTIL, EM QUAL LUGAR DO CASTELO RAPUNZEL FOI TRANCADA?","PORÃO","COZINHA","GARAGEM","TORRE","4","A",,"N","V"
1804,"SEGUNDO A BÍBLIA, QUEM ABRIU O MAR VERMELHO COM O CAJADO?","LUCAS","MOISÉS","PEDRO","JOÃO","2","A",,"N","V"
1500,"SEGUNDO A BÍBLIA, O PRIMEIRO HOMEM E A PRIMEIRA MULHER FORAM...","JOSÉ E MARIA","MAL-EDUCADOS","ROMEU E JULIETA","ADÃO E EVA","4","A",,"N","V"
1498,"QUE NOME RECEBE O PENACHO UTILIZADO NA CABEÇA PELOS ÍNDIOS?","COROA","CARAPUÇA","COCAR","CAVILHAS","3","A",,"N","V"
1497,"TINTEIRO E ESFEROGRÁFICA SÃO TIPOS DE QUÊ?","BALAS","AQUARELAS","ALIANÇAS","CANETAS","4","A",,"N","V"
1496,"UMA VIAGEM DE NAVIO COM TURISTAS EM VISITA A VÁRIOS PORTOS É CHAMADA DE:","VÔO","CRUZEIRO","RETIRO","ESCALADA","2","A",,"N","V"
1495,"A MAIORIDADE CIVIL É ALCANÇADA COM QUANTOS ANOS?","21 ANOS","18 ANOS","20 ANOS","16 ANOS","1","A",,"N","V"
1481,"A FRASE ""ABRA-TE SÉSAMO"" FOI DITA POR QUEM ?","D.PEDRO I","HÉRCULES","ALI BABÁ","DUNGA","3","A",,"N","V"
1493,"A DAMA-DA-NOITE É CONHECIDA COMO UMA:","SENHORA","PLANTA","PRINCESA","MATILHA","2","A",,"N","V"
1505,"RELINCHO É A VOZ DE QUAL ANIMAL?","CARNEIRO","CAVALO","BOI","BODE","2","A",,"N","V"
1491,"O SENHOR É MEU PASTOR E NADA ME FALTARÁ FAZ PARTE DOS SALMOS DE QUEM?","JÓ","DAVI","JÔNATAS","SALOMÃO","2","A",,"N","V"
1490,"QUAL É A DATA EM QUE SE COMEMORA O DIA DOS PAIS?","ÚLTIMO DOMINGO DE AGOSTO","SEGUNDO DOMINGO DE MAIO","SEGUNDO SÁBADO DE AGOSTO","SEGUNDO DOMINGO DE AGOSTO","4","A",,"N","V"
1489,"UM INDIVÍDUO QUE DEIXA DE PAGAR SUAS CONTAS É TIDO COMO:","PIPOQUEIRO","CALOTEIRO","CARPINTEIRO","LANTERNEIRO","2","A",,"N","V"
1488,"VERDE E ROSA SÃO AS CORES DE QUAL ESCOLA DE SAMBA CARIOCA?","VIRADOURO","MANGUEIRA","BEIJA-FLOR","PORTELA","2","A",,"N","V"
1487,"SARAPATEL É...","UMA PESSOA SARADA","UMA COMIDA","UM CALÇADO","UM LUGAR PARA PATOS","2","A",,"N","V"
1486,"UMA REPRESENTAÇÃO TEATRAL PODE SER CHAMADA DE:","BOANA","PEÇA","HARPA","BULEVAR","2","A",,"N","V"
1485,"UMA PESSOA QUE NÃO CRÊ EM DEUS É CHAMADA DE...","PENTECOSTAL","ATEU","PROTESTANTE","CATÓLICO","2","A",,"N","V"
1484,"UMA PESSOA QUE FOI ISENTA DE ALGUMA OBRIGAÇÃO ESTÁ:","PRESA","ENCARCERADA","DISPENSADA","OBRIGADA","3","A",,"N","V"
1483,"UMA PESSOA QUE FALA MUITAS LÍNGUAS É:","POLIGLOTA","LIGEIRO","LINGUADO","LINGULADO","1","A",,"N","V"
1517,"UMA PESSOA QUE CANTA BEM É COMPARADA COM QUAL PÁSSARO?","PÁSSARO PRETO","ROUXINOL","TUCANO","BEM-TE-VI","2","A",,"N","V"
