NUMERO,PERGUNTA,RESP1,RESP2,RESP3,RESP4,CERTA,TIPO,FLAG,JA_FOI,MATERIA
579,"PORTUGUÊS, ESPANHOL E ITALIANO SÃO IDIOMAS DERIVADOS DE QUAL LÍNGUA?","LATIM","INGLÊS","ARAMAICO","GALÊS","1","A",,"N","P"
578,"PONTUAL SIGNIFICA:","TARDIO","LENTO","PRECISO","ATRASADO","3","A",,"N","P"
577,"PERFURAR É O MESMO QUE:","DESPACHAR","CAVAR","LAVAR","ALINHAR","2","A",,"N","P"
576,"O TERMO GALOPE ESTÁ RELACIONADO COM:","CHUVA","PLANTAÇÃO","PESCA","CAVALO","4","A",,"N","P"
575,"O SUFIXO ""FOBIA"" É RELATIVO A:","FOME","MEDO","CANSAÇO","ESTUDO","2","A",,"N","P"
574,"O SINÔNIMO DE NÍTIDO É:","EMBAÇADO","LIMPO","SUJO","ESCURO","2","A",,"N","P"
565,"O QUE SIGNIFICA RUBRO?","VERDE","AZUL","BRANCO","VERMELHO","4","A",,"N","P"
572,"EM QUAL DAS PALAVRAS ABAIXO A ESCRITA  ESTÁ CORRETA ?","SALSICHA","SALCHICHA","SALXICHA","SALSIXA","1","A",,"N","P"
580,"QUAL É O AUMENTATIVO DE CHAPÉU?","CHAPEUZÃO","CHAPELÃO","CHAPEUZARRÃO","CHAPEÃO","2","A",,"N","P"
570,"QUAL É O FEMININO DE CONDE?","CONDA","CONDENSA","CONDINA","CONDESSA","4","A",,"N","P"
569,"QUAL É O FEMININO DE ATEU?","ATEUA","ATEÍNA","ATIA","ATÉIA","4","A",,"N","P"
568,"QUAL É O FEMININO DE ANÃO?","ANACÃ","NANI","ANOA","ANÃ","4","A",,"N","P"
567,"QUAL É O CONTRÁRIO DE MAJORITÁRIO?","MINORITÁRIO","MINOTÁRIO","MAIORITÁRIO","MIJORITÁRIO","1","A",,"N","P"
566,"QUAL É O COLETIVO DE PÃO?","FORNADA","PANHAME","FORNEIRO","PANDEIRO","1","A",,"N","P"
541,"QUAL É O COLETIVO DE ESTRELAS?","PLANETA","LUA","CONSTELAÇÃO","SOL","3","A",,"N","P"
518,"QUAL DESTES MEIOS DE COMUNICAÇÃO POSSUI LINGUAGEM ESCRITA?","TELEFONE","JORNAL","RÁDIO","ALTO-FALANTE","2","A",,"N","P"
550,"QUAL É O AUMENTATIVO DE TESOURA?","TESOURONA","TESOURÃO","TESOURAÇA","TESOURETE","2","A",,"N","P"
530,"O QUE SIGNIFICA MARTÍRIO?","ALEGRIA","AMOR","CARINHO","SOFRIMENTO","4","A",,"N","P"
529,"QUAL É O AUMENTATIVO DE CASA?","CASARÃO","CASEBRE","CASADINHA","CASALINHA","1","A",,"N","P"
528,"QUAL É O ANTÔNIMO DE LEAL?","ALEGRE","COMPANHEIRO","CONFIÁVEL","DESLEAL","4","A",,"N","P"
527,"QUAL É O ANTÔNIMO DE IDA?","RETIRADA","FUGIDA","VOLTA","SAÍDA","3","A",,"N","P"
526,"QUAL É O ANTÔNIMO DE CEDO?","MANHÃ","ANTES","TARDE","MADRUGADA","3","A",,"N","P"
517,"QUAL É O ANTÔNIMO DE BENIGNO?","BONDOSO","AFETUOSO","MALÉFICO","AGRADÁVEL","3","A",,"N","P"
524,"QUAL É O ANTÔNIMO DE ALTO?","FINO","GRANDE","BAIXO","LARGO","3","A",,"N","P"
532,"QUAL É O ANTÔNIMO DA PALAVRA ""COM""?","SOB","SESTA","SÓ","SEM","4","A",,"N","P"
522,"QUAL É O COLETIVO DE DISCO?","ENXAME","CHUSMA","ALCATÉIA","DISCOTECA","4","A",,"N","P"
521,"LACRIMEJAR É O MESMO QUE:","CHORAR","GRITAR","FALAR","COMER","1","A",,"N","P"
520,"NA GÍRIA POPULAR,O QUE SIGNIFICA MÃO-LEVE?","SEQUESTRADOR","FOFOQUEIRO","LADRÃO","DESARRUMADO","3","A",,"N","P"
519,"NA EXPRESSÃO POPULAR, O QUE SIGNIFICA ""DAR O BOLO""?","SE COMPROMETER","IR À UM COMPROMISSO","MARCAR UM COMPROMISSO","FALTAR À UM COMPROMISSO","4","A",,"N","P"
539,"NA CONJUGAÇÃO VERBAL, O TEMPO PRETÉRITO PERFEITO REFERE-SE:","AO PRESENTE","AO FUTURO","À PREVISÃO","AO PASSADO","4","A",,"N","P"
523,"MONTEIRO LOBATO FICOU FAMOSO POR SER:","PIANISTA","CANTOR","ESCRITOR","PINTOR","3","A",,"N","P"
525,"MONTANHISMO É O MESMO QUE?","GEOLOGISMO","ALPINISMO","PEDREIRA","SUBIDEIRA","2","A",,"N","P"
547,"MONOSSÍLABA É A PALAVRA QUE TEM:","DUAS SÍLABAS","TRÊS SÍLABAS","MAIS DE TRÊS SÍLABAS","UMA SÍLABA","4","A",,"N","P"
546,"MASMORRA É O MESMO QUE:","PRISÃO","PREGUIÇA","PEDRA DE MÁRMORE","SONOLÊNCIA","1","A",,"N","P"
545,"O QUE SIGNIFICA PRETÉRITO?","ATUALIZADO","PASSADO","FUTURO","PRESENTE","2","A",,"N","P"
544,"LASCADA E POLIDA SÃO TIPOS DE:","ÁGUA","PEDRA","AR","FOGO","2","A",,"N","P"
543,"NO DITADO POPULAR, ""CAIU NA REDE...""","É PEIXE","É UMA SEREIA","É GOL","É CHORÃO","1","A",,"N","P"
542,"JUGULAR  É ALGO PERTENCENTE...","À GARGANTA","AO OUVIDO","AO PEITO","AOS PÉS","1","A",,"N","P"
533,"IRRIGAR A TERRA SIGNIFICA:","ADUBÁ-LA","MOLHÁ-LA","DRENÁ-LA","ARENÁ-LA","2","A",,"N","P"
540,"INODORO É O MESMO QUE:","SEM COR","SEM SOM","SEM CHEIRO","SEM SABOR","3","A",,"N","P"
548,"INAUDÍVEL É AQUILO QUE NÃO SE PODE:","COMER","OUVIR","VER","PEGAR","2","A",,"N","P"
538,"GRUTA É O MESMO QUE:","ANIMAL","PEDRA PRECIOSA","ARBUSTO","CAVERNA","4","A",,"N","P"
537,"FLEXÍVEL SIGNIFICA O MESMO QUE:","MALEÁVEL","DURO","INQUEBRÁVEL","RÍGIDO","1","A",,"N","P"
536,"DIZ O DITADO POPULAR: ""AS PAREDES TÊM...""","OLHOS","VAZAMENTOS","OUVIDOS","BURACOS","3","A",,"N","P"
535,"LUSTRAR É O MESMO QUE:","APAGAR","DESCREVER","POLIR","ILUSTRAR","3","A",,"N","P"
534,"O QUE SIGNIFICA A PALAVRA LOCAR?","COMPRAR","ALUGAR","EMPRESTAR","DEVOLVER","2","A",,"N","P"
582,"QUAL É O FEMININO DE FRADE?","SACERDOTISA","PITONISA","FREIRA","PADRE","3","A",,"N","P"
630,"O QUE SIGNIFICA MAROTO?","ESPERTO","CANSADO","BONITO","SAUDÁVEL","1","A",,"N","P"
573,"O QUE SIGNIFICA MADURAR?","LEVANTAR CEDO","AMANHECER","MANTER-SE DURO","AMADURECER","4","A",,"N","P"
626,"O QUE SIGNIFICA LAMBUZAR?","SUJAR","LIMPAR","REFRESCAR","CHEIRAR","1","A",,"N","P"
625,"O QUE SIGNIFICA ESTAFA?","DESCANÇO","ESTADIA","ESTUFA","CANSEIRA","4","A",,"N","P"
624,"O QUE SIGNIFICA ÉDEN?","PECADO","PARAÍSO","ÉPOCA","ESTAÇÃO","2","A",,"N","P"
623,"O QUE SIGNIFICA CAUÇÃO?","ACESSÓRIO FEMININO","INSEGURANÇA","CALÇA GRANDE","GARANTIA","4","A",,"N","P"
622,"NA LINGUAGEM POPULAR, O QUE É URUCUBACA?","PLANTA","FELICIDADE","BONS FLUÍDOS","MÁ SORTE","4","A",,"N","P"
613,"O QUE SIGNIFICA A SIGLA DDD?","DISCAGEM DIRETA GRATUITA","DISCAGEM DIRETA A DISTÂNCIA","DISCAGEM DIRETA INTERNACIONAL","DISCAGEM DIRETA A COBRAR","2","A",,"N","P"
620,"NÁUSEA É O MESMO QUE:","FOME","DOR","ENJÔO","SATISFAÇÃO","3","A",,"N","P"
628,"O QUE SIGNIFICA A EXPRESSÃO ""BOTAR A BOCA NO TROMBONE""?","RECITAR UM POEMA","FICAR CALADO","SER LOUCO","CONTAR PARA TODOS","4","A",,"N","P"
618,"O QUE SIGNIFICA ""SUSTAR UM CHEQUE""?","ASSUSTAR O CREDOR","RASGAR O CHEQUE","RASURAR O CHEQUE","SUSPENDER O PAGAMENTO","4","A",,"N","P"
617,"O QUE QUER DIZER ESPONTÂNEO?","RÍGIDO","RIDÍCULO","RELUTANTE","SINCERO","4","A",,"N","P"
616,"O NÚMERO 60 É ESCRITO COM QUANTAS LETRAS S?","UMA","QUATRO","DUAS","TRÊS","4","A",,"N","P"
615,"O CONTRÁRIO DE DESTRUIR É:","DERRUBAR","CONSTRUIR","DESTROÇAR","DESMANCHAR","2","A",,"N","P"
614,"NO DITO POPULAR,  ""QUEM ESPERA SEMPRE...""","CANSA","RECLAMA","DANÇA","ALCANÇA","4","A",,"N","P"
636,"NO DITADO POPULAR, ""O SEGURO MORREU DE...""","SEDE","DOENÇA","VELHO","FOME","3","A",,"N","P"
638,"O QUE SIGNIFICA NARRAR?","CHUTAR","CONTAR","ASSOVIAR","COMER","2","A",,"N","P"
621,"O QUE SIGNIFICA BEL-PRAZER?","VONTADE PRÓPRIA","PRAZER ESTÉTICO","ALIMENTO","INFLAMAÇÃO NO OUVIDO","1","A",,"N","P"
2684,"O PREFIXO PSEUDO SIGNIFICA:","FALSO","DISTANTE","IDÊNTICO","PRÓXIMO","1","B",,"N","P"
3366,"O PLURAL DE CRISTÃO É:","CRISTÕES","CRISTÃES","CRISTÃ","CRISTÃOS","4","B",,"N","P"
3364,"MIGUEL DE CERVANTES FOI UM ESCRITOR...","BRASILEIRO","ITALIANO","ARGENTINO","ESPANHOL","4","B",,"N","P"
3368,"QUAL FOI A OBRA MAIS FAMOSA DE SAINT-EXUPÉRY?","O PROFETA","IDADE DA RAZÃO","O PEQUENO PRÍNCIPE","HELENA","3","B",,"N","P"
3369,"QUAL É O SOBRENOME DE JULIETA DA TRAGÉDIA DE SHAKESPEARE?","CAPULETO","MEDICIS","MONTECCHIO","CAPPELLANO","1","B",,"N","P"
3370,"QUAL DESSAS OBRAS REFERE-SE AO PERÍODO DA ESCRAVIDÃO?","ROMEU E JULIETA","MADAME BOVARY","O NAVIO NEGREIRO","LUCÍOLA","3","B",,"N","P"
3371,"O POETA HOMERO ERA NATURAL DE ONDE?","ITÁLIA","ÁUSTRIA","ESPANHA","GRÉCIA","4","B",,"N","P"
3372,"O CONJUNTO DE PARTES DE VÁRIAS OBRAS É CHAMADO DE:","COMARCA","COLÔNIA","COLUNA","COLETÂNEA","4","B",,"N","P"
3373,"EM QUE ESTADO INCIOU A SEMANA DA ARTE MODERNA, EM 1922?","RIO GRANDE DO SUL","SÃO PAULO","RIO DE JANEIRO","PARANÁ","2","B",,"N","P"
3374,"EM QUAL CONTINENTE SURGIU O ROMANTISMO EM MEADOS DO SÉCULO XVIII?","OCEANIA","EUROPA","AMÉRICA","ÁSIA","2","B",,"N","P"
3375,"QUAL DESSES NOMES NÃO REPRESENTA UM MOVIMENTO LITERÁRIO?","REALISMO","MARXISMO","CLASSICISMO","ARCADISMO","2","B",,"N","P"
3376,"QUAL DESSAS OBRAS FOI ESCRITA POR MACHADO DE ASSIS?","O AUTO DA COMPADECIDA","QUINCAS BORBA","A BELA ADORMECIDA","O MENINO MALUQUINHO","2","B",,"N","P"
3377,"DE ACORDO COM CARLOS DRUMMOND, ""NO MEIO DO CAMINHO TINHA...""","UMA FLOR","UM CARRO","UMA LAGOA","UMA PEDRA","4","B",,"N","P"
3378,"BUCÓLICO É RELATIVO A:","CAMPESTRE","MARÍTIMO","URBANO","CORPORAL","1","B",,"N","P"
3382,"QUAL É A EXPRESSÃO CORRETA?","DUZENTA GRAMA","DUZENTOS GRAMOS","DUZENTOS GRAMAS","DOZENTO GRAMAS","3","B",,"N","P"
3391,"FLÂMULA É SINÔNIMO DE:","DOENÇA","BANDEIRA","NAVIO","FLAUTA","2","B",,"N","P"
3390,"COMO DIZ O DITADO POPULAR:"" QUEM COM FERRO FERE, COM FERRO SERÁ...""?","MORTO","ASSASSINADO","MASSACRADO","FERIDO","4","B",,"N","P"
3389,"COMO É CHAMADA A PALAVRA QUE TEM MAIS DE TRÊS SÍLABAS?","TRISSÍLABA","DISSÍLABA","MONOSSÍLABA","POLISSÍLABA","4","B",,"N","P"
3388,"COMO É CHAMADO O TRACINHO QUE SEPARA UMA PALAVRA COMPOSTA?","ITEM","HÍFEN","TRAVESSÃO","HIFEMA","2","B",,"N","P"
3387,"COMO É DENOMINADA UMA ESTROFE DE CINCO VERSOS?","SETILHA","QUINTILHA","MONÓSTICO","TRITILHA","2","B",,"N","P"
3386,"COMO SÃO CLASSIFICADOS OS PRONOMES: ""EU, TU, ELE""?","POSSESSIVOS","DEMONSTRATIVOS","RELATIVOS","PESSOAIS","4","B",,"N","P"
3385,"COMO SE CHAMA A PALAVRA QUE É ACENTUADA NA ÚLTIMA SILABA?","PAROXÍTONA","PROPAROXÍTONA","ADJETIVO","OXÍTONA","4","B",,"N","P"
3379,"COMO SE CONJUGA O VERBO AVERIGUAR NA 1ª PESSOA DO PRESENTE DO INDICATIVO?","AVERIGÜEI","AVERIGUA","AVERIGUO","AVERIGÚE","3","B",,"N","P"
3383,"CORRESPONDÊNCIA SEM IDENTIFICAÇÃO DO REMETENTE É CHAMADA DE:","ANÔNIMA","HETERÔNIMA","PSEUDÔNIMA","HOMÔNIMA","1","B",,"N","P"
3392,"EM PORTUGUÊS, QUAL É O NOME DA VOGAL QUE NÃO RECEBE ACENTO TÔNICO?","OXÍTONO","TÔNICO","ANATÔMICO","ÁTONO","4","B",,"N","P"
3381,"HIPOTENSÃO É O MESMO QUE:","DOR DE CABEÇA","PRESSÃO BAIXA","PRESSÃO ALTA","FEBRE ALTA","2","B",,"N","P"
3384,"IMPOLUTO É O MESMO QUE:","LIMPO","POLUÍDO","IMUNDO","SUJO","1","B",,"N","P"
3380,"INDAGAR É O MESMO QUE:","RESPONDER","DEPILAR","INVESTIGAR","GAGUEJAR","3","B",,"N","P"
3365,"INFRINGIR SIGNIFICA:","CASTIGAR","RESPEITAR","VIOLAR","ENCOSTAR","3","B",,"N","P"
3163,"EM CLASSE GRAMATICAL A PALAVRA ""AQUI"" É UM:","ADJETIVO","PRONOME","ADVÉRBIO","VERBO","3","B",,"N","P"
3218,"SERRA É UM AGRUPAMENTO DE:","FLORES","PRAIAS","MONTANHAS","LOBOS","3","B",,"N","P"
3217,"QUEM NASCE EM BELÉM É:","BELENSE","BELENHENSE","BELEANO","BELENENSE","4","B",,"N","P"
3216,"QUEM NASCE EM ITU É...","ITUETANO","ITUANO","ITUENSE","ITULINO","2","B",,"N","P"
3215,"QUEM NASCE EM MACEIÓ É:","MACEIOENSE","MACEIOANO","MACEIOSANO","MACEIOSO","1","B",,"N","P"
3214,"QUEM NASCE EM RIBEIRÃO PRETO-SP É...","RIBEIRÃO-PRETANO","RIBEIRINO-PRETENSE","RIBEIRINHO-PRETENSE","RIBEIRENSE","1","B",,"N","P"
3213,"QUEM NASCE NA TERRA DO FOGO É:","FOGOSO","FUGAZ","FUEGUINO","FOGUETEIRO","3","B",,"N","P"
3212,"QUIÇÁ É UM ADVÉRBIO QUE EXPRESSA...","AFIRMAÇÃO","TEMPO","MODO","DÚVIDA","4","B",,"N","P"
3211,"RETIFICAR É O MESMO QUE:","DIVULGAR","ANALISAR","CORRIGIR","CONFIRMAR","3","B",,"N","P"
3210,"RÚSTICO É O MESMO QUE:","INESQUECÍVEL","INOFENSIVO","RUDE","INVESTIGADOR","3","B",,"N","P"
3209,"SENTINELA É O MESMO QUE...","DAMA","CADEIRA","SOLDADO ARMADO","PRINCESA","3","B",,"N","P"
3208,"QUEM ESCREVEU ""O AUTO DA COMPADECIDA''?","GIL  VICENTE","ALMEIDA GARRETT","ARIANO SUASSUNA","DIAS GOMES","3","B",,"N","P"
3207,"SILVICULTURA É O ESTUDO DE QUÊ?","SERPENTES","RAPOSAS","FLORESTAS","SEREIAS","3","B",,"N","P"
3191,"UMA PESSOA NASCIDA EM CURITIBA É CHAMADA DE:","CURITIBENSE","CURITIBONENSE","CURITIBANO","CURITIBENHO","3","B",,"N","P"
3205,"UMA PESSOA SISUDA É:","MACHUCADA","TRISTE","SÉRIA","ALEGRE","3","B",,"N","P"
3219,"UMA PESSOA SUTIL É:","DELICADA","RABUGENTA","HONESTA","HIPÓCRITA","1","B",,"N","P"
3203,"O QUE É AFONIA?","PERDA DA MEMÓRIA","PERDA DA VOZ","PERDA DA AUDIÇÃO","PERDA DA LOCOMOÇÃO","2","B",,"N","P"
3202,"A PALAVRA ""PROLE"" SE REFERE À:","TEMPESTADES","PROBLEMAS","TERRA","FILHOS","4","B",,"N","P"
3201,"A QUE SE REFERE A PALAVRA BOREAL?","OESTE","LESTE","NORTE","SUL","3","B",,"N","P"
3200,"ALBERTO CAEIRO É HETERÔNIMO DE QUAL ESCRITOR?","VINÍCIUS DE MORAIS","CECÍLIA MEIRELES","FERNANDO PESSOA","CARLOS DRUMMOND DE ANDRADE","3","B",,"N","P"
3199,"SAVELHA É:","UM FRUTO","UM PEIXE","UMA ABELHA","UMA FLOR","2","B",,"N","P"
3198,"QUAL PALAVRA É O SINÔNIMO DO TERMO ""VIR À SUPERFÍCIE""?","IMERGIR","SUBMERGIR","MERGULHAR","VIR À TONA","4","B",,"N","P"
3197,"ALMÁRIO É O MESMO QUE:","BANCO","ARMÁRIO","GUARDA-ROUPA","CADEIRA","2","B",,"N","P"
3196,"IR À BANCARROTA SIGNIFICA:","FURTAR","ENRIQUECER","GANHAR","FALIR","4","B",,"N","P"
3195,"JOÃZINHO FOI À FEIRA E PEDIU CINCO ...","PASTÉIS","PASTELES","PASTELS","PASTÉUS","1","B",,"N","P"
3194,"LAPSO SIGNIFICA:","TOSCO","LÁPIS CARO","TRUQUE","FALHA","4","B",,"N","P"
3193,"LAUDA É O MESMO QUE:","COMIDA","TIPO DE BEBIDA","PÁGINA DE LIVRO","MOLDURA","3","B",,"N","P"
3233,"MEU É UM PRONOME:","RETO","INTERROGATIVO","DEMONSTRATIVO","POSSESSIVO","4","B",,"N","P"
3204,"NEGLIGENTE SIGNIFICA:","TRABALHADOR","INDOLENTE","CAUTELOSO","CUIDADOSO","2","B",,"N","P"
3206,"NULIFICAR É:","REJEITAR","PREENCHER NÚCLEO","CONTAR NÚMEROS","ANULAR","4","B",,"N","P"
3247,"QUEM ESCREVEU O POEMA ""JOSÉ"" EM 1942?","OSWALD DE ANDRADE","LUÍS DE CAMÕES","CARLOS DRUMMOND","EÇA DE QUEIRÓS","3","B",,"N","P"
3246,"QUAL O SUPERLATIVO DA PALAVRA SIMPLES?","MERO","HUMILDE","SINGELO","SIMPLÍSSIMO","4","B",,"N","P"
3245,"QUEM ESCREVEU O LIVRO ""A VOLTA AO MUNDO EM 80 DIAS""?","PAULO COELHO","MACHADO DE ASSIS","JÚLIO VERNE","LEON ARONS","3","B",,"N","P"
3244,"QUAL PALAVRA ESTÁ GRAFADA CORRETAMENTE?","EXCEÇÃO","EXCESSÃO","EXSSEÇÃO","EXSSESSÃO","1","B",,"N","P"
3243,"QUAL PALAVRA ESTÁ GRAFADA CORRETAMENTE?","PREVILÉGIO","PRIVILÉGEO","PREVILÉGEO","PRIVILÉGIO","4","B",,"N","P"
3242,"QUAL PALAVRA NÃO É PROPAROXÍTONA?","SAÚVA","MÉDICO","FÚLGIDOS","AMÉRICA","1","B",,"N","P"
3241,"QUAL POETA ESCREVEU: ""AS FEIAS QUE ME PERDOEM, MAS BELEZA É FUNDAMENTAL""?","JOÃO GILBERTO","VINÍCIUS DE MORAES","TOM JOBIM","CAZUZA","2","B",,"N","P"
2682,"QUAL PRONOME É DEMONSTRATIVO?","MEU","VOSSA MAJESTADE","ESTA","VOCÊ","3","B",,"N","P"
3240,"QUEM ESCREVEU  MEU PÉ DE LARANJA LIMA?","JOSÉ MAURO DE VASCONCELOS","CECÍLIA MEIRELES","ÉRICO VERÍSSIMO","RAQUEL DE QUEIRÓS","1","B",,"N","P"
1991,"QUEM ESCREVEU ""CASA-GRANDE E SENZALA"" UMA VISÃO SOBRE A POLÍTICA ESCRAVAGISTA?","MANUEL BANDEIRA","MONTEIRO LOBATO","GILBERTO FREIRE","MACHADO DE ASSIS","3","B",,"N","P"
3239,"QUEM ESCREVEU ""O ALIENISTA"", UMA NOVELA RECHEADA DE PORMENORES?","RUBEM BRAGA","RUBEM FONSECA","AFONSO LIMA BARRETO","MACHADO DE ASSIS","4","B",,"N","P"
3268,"INTEMPESTIVO É O MESMO QUE:","CONFUSO","VIOLENTO","CALMO","INOPORTUNO","4","B",,"N","P"
3267,"QUAL O ANTÔNIMO DE CÔNCAVO?","ESCAVADO","CONVEXO","RETO","CAVADO","2","B",,"N","P"
3266,"QUAL É O COLETIVO DE OVELHAS?","MANADA","MATILHA","MATULA","MALHADA","4","B",,"N","P"
3265,"QUAL É A FORMA CORRETA DO VERBO VALER NA 1ª PESSOA NO PRESENTE DO INDICATIVO?","EU VALO","EU VALE","EU VALHO","EU VALIO","3","B",,"N","P"
3264,"QUAL É A GRAFIA CORRETA?","XICARA","XÍCARA","CHICARA","CHÍCARA","2","B",,"N","P"
3249,"QUAL É A PALAVRA QUE NÃO SE ESCREVE COM ""X""?","XÍCARA","XÁCARA","ENXADA","ENXUTO","2","B",,"N","P"
3262,"QUAL É ANTÔNIMO DE OSTENSIVO?","CALMO","EXAGERADO","TRISTE","DISCRETO","4","B",,"N","P"
3276,"QUAL É O ANTÔNIMO DE BEM?","MAL","MÁ","MALE","MAU","1","B",,"N","P"
3260,"QUAL É O ANTÔNIMO DE MAL?","RUIM","BOM","LEGAL","BEM","4","B",,"N","P"
3259,"QUAL É O ANTÔNIMO DE NEGLIGENTE?","PREGUIÇOSO","ATENTO","DESPREVENIDO","DESATENTO","2","B",,"N","P"
3258,"QUAL É O PLURAL DE QUALQUER?","QUAISQUER","QUALQUERES","QUALQUER","QUAISQUERES","1","B",,"N","P"
3257,"QUAL É O COLETIVO DE ESTRELAS?","PLANETA","ESTRELAR","CONSTELAÇÃO","SOL","3","B",,"N","P"
3256,"QUAL DESTAS PALAVRAS É ADVÉRBIO DE TEMPO?","ATRÁS","JAMAIS","TALVEZ","MUITO","2","B",,"N","P"
3255,"QUAL É O DIMINUTIVO DA PALAVRA RUA?","RUELA","RUINHA","RUACEIRA","RUAZINHA","1","B",,"N","P"
3254,"QUAL É O FEMININO DE PAPA?","PAPONA","PAPOA","PAPISA","PAISA","3","B",,"N","P"
3253,"QUAL É O NOME DE CADA UMA DAS LINHAS QUE CONSTITUEM UM POEMA?","VERSO","VERSÍCULO","CAPÍTULO","RIMA","1","B",,"N","P"
3252,"QUAL É O PLURAL DA PALAVRA BEM-TE-VI?","BENS-TE-VIS","BEM-TE-VI","BEM-TE-VIS","BENS-TE-VI","3","B",,"N","P"
3251,"QUAL É O PLURAL DE BANANA-DA-TERRA?","BANANA-DA-TERRAS","BANANAS-DA-TERRA","BANANAS-DAS-TERRAS","BANANA-DAS-TERRAS","2","B",,"N","P"
3250,"QUAL É O PLURAL DE CHAPÉU-DE-SOL?","CHAPÉUS-DE-SOL","CHAPÉIS-DE-SOL","CHAPÉUS-DE-SÓIS","CHAPÉU-DE-SÓIS","1","B",,"N","P"
3290,"QUAL É O PLURAL DE CRIADO-MUDO?","CRIADOS-MUDO","CRAIDO-MUDOS","CRIADOS-MUDOS","CRIADO-MUDO","3","B",,"N","P"
3292,"CÁLIDO É UMA PALAVRA:","PROPAROXÍTONA","OXÍTONA","PAROXÍTONA","MONOSSÍLABA","1","B",,"N","P"
3263,"QUAL É O ANTÔNIMO DE SÓLIDO?","GASOSO","ESPUMANTE","LÍQUIDO","LÁCTEO","3","B",,"N","P"
3303,"QUAL DESSAS PALAVRAS ESTÁ COM ERRO NA SUA ORTOGRAFIA?","ENXUTO","ENXOÇAR","ENXADA","ENXOFRE","2","B",,"N","P"
3302,"QUAL DAS ALTERNATIVAS CORRESPONDE À UM PRONOME INDEFINIDO?","ESTE","TEU","NENHUM","QUANTO","3","B",,"N","P"
3301,"QUAL DAS ALTERNATIVAS ESTÁ CORRETA?","PALITÓ","PALHETOL","PALHETÓ","PALETÓ","4","B",,"N","P"
3300,"QUAL DAS PALAVRAS ABAIXO ESTÁ CORRETAMENTE GRAFADA?","GUARDA-NOTURNOS","VIRAS-LATAS","GUARDA-ROUPAS","COUVE-FLORES","3","B",,"N","P"
3299,"QUAL DAS PALAVRAS ABAIXO NÃO É UM COLETIVO?","DISCOTECA","BIBLIOTECA","HIPOTECA","PINACOTECA","3","B",,"N","P"
3298,"QUAL DAS SEGUINTES PALAVRAS É PROPAROXÍTONA?","ANÁGUA","ÍMÃ","MÁQUINA","CHAPÉU","3","B",,"N","P"
3297,"QUAL DESSAS PALAVRAS APRESENTA A ORTOGRAFIA CORRETA ?","SOBRANCELHA","SOMBRANCELHA","SOBRANSELHA","SOMBRANSELHA","1","B",,"N","P"
3296,"QUAL DESSAS PALAVRAS É SINÔNIMO DE ÁRBITRO?","ATRITO","JUIZ","ÁRBUTO","JUNCO","2","B",,"N","P"
3295,"QUAL DESSAS PALAVRAS É SINÔNIMO DE OSTENTAÇÃO?","EXIBICIONISMO","PRUDÊNCIA","RECATO","MODÉSTIA","1","B",,"N","P"
3294,"QUAL DESTAS PALAVRAS É UM SUBSTANTIVO CONCRETO?","DOR","CORAÇÃO","FELICIDADE","TRISTEZA","2","B",,"N","P"
3293,"QUAL DESSAS PALAVRAS É UM SUBSTANTIVO CONCRETO?","PAIXÃO","EMOÇÃO","COMPREENSÃO","MOEDA","4","B",,"N","P"
3277,"QUAL DESTAS PALAVRAS É UM HIATO?","TUBO","PIADA","XADREZ","PRATO","2","B",,"N","P"
3291,"QUAL DESSAS PALAVRAS ESTÁ GRAFADA CORRETAMENTE?","MADERERA","MADEREIRA","MADEIRERA","MADEIREIRA","4","B",,"N","P"
3305,"QUAL DESSAS PALAVRAS NÃO É SINÔNIMO DE PÂNTANO?","LAMACEIRO","ATOLEIRO","BREJO","AGRESTE","4","B",,"N","P"
3289,"QUAL DESSAS PALAVRAS NÃO SE REFERE À ALUNO?","ESTUDANTE","DISCENTE","DISCÍPULO","CATEDRÁTICO","4","B",,"N","P"
3288,"QUAL DESSAS PALAVRAS NÃO SIGNIFICA LEVITAR?","ELEVAR","ALÇAR","ERGUER","ABAIXAR","4","B",,"N","P"
3287,"QUAL DESSAS PALAVRAS NÃO SIGNIFICA SEMELHANTE?","DIVERGENTE","ANÁLOGO","SIMILAR","PARECIDO","1","B",,"N","P"
3286,"QUAL DESSAS PALAVRAS POSSUI A MESMA ESCRITA TANTO EM PORTUGUÊS QUANTO EM INGLÊS?","CHOCOLATE","ÁGUA","LEITE","PÃO","1","B",,"N","P"
3285,"QUAL DESSAS PALAVRAS REFERE-SE À ESTAÇÃO DA PRIMAVERA?","PUERIL","PÚRPURA","PRIMAVERIL","PONCHE","3","B",,"N","P"
3284,"QUAL DESSES NÃO É UM SINÔNIMO DE SELVAGEM?","SILVESTRE","AGRESTE","URBANO","SELVÁTICO","3","B",,"N","P"
3283,"QUAL É O PLURAL DE SALÁRIO-MÍNIMO?","SALÁRIOS-MÍNIMOS","SALÁRIOS-MÍNIMO","SALÁRIO-MÍNIMOS","SALÁRIO-MÍNIMO","1","B",,"N","P"
3282,"QUAL DESSAS PALAVRAS É TRISSÍLABA?","BRASIL","SAÚDE","PILHA","TELEFONE","2","B",,"N","P"
3281,"A PALAVRA QUE TEM QUATRO SÍLABAS É:","MONOSSÍLABA","TRISSÍLABA","DISSÍLABA","TETRASSÍLABA","4","B",,"N","P"
3280,"VOSSA MAGNIFICÊNCIA É UM PRONOME DE TRATAMENTO USADO PARA SE DIRIGIR A QUEM?","REITOR DE UNIVERSIDADE","DELEGADO DE POLÍCIA","DESEMBARGADOR DA JUSTIÇA","JUIZ DE DIREITO","1","B",,"N","P"
3279,"RETROCEDER É O MESMO QUE:","RECUAR","AVANÇAR","PARAR","TRAUMATIZAR","1","B",,"N","P"
3269," QUAL É O AUMENTATIVO CORRETO DA PALAVRA CORPO?","CORPARÉU","CORPANZIL","CORPÃO","CORPARRÃO","2","B",,"N","P"
3270,"A PALAVRA FICÇÃO SIGNIFICA:","VERACIDADE","IMAGINAÇÃO","REALIDADE","OBJETIVIDADE","2","B",,"N","P"
3271,"A PALAVRA GRAFADA CORRETAMENTE É:","CHUXU","XUXU","CHUCHU","XUCHU","3","B",,"N","P"
3272,"A PALAVRA LARANJAL É UM SUBSTANTIVO:","ABSTRATO","NUMERAL","PRIMITIVO","COLETIVO","4","B",,"N","P"
3273,"A PALAVRA LIVRARIA É FORMADA POR:","AGLUTINAÇÃO","JUSTAPOSIÇÃO","DERIVAÇÃO","COMPOSIÇÃO","3","B",,"N","P"
3274,"A PALAVRA LÚDICO ESTÁ RELACIONADA A:","LOUCURA","DIVERTIMENTO","LUA","ESPAÇO","2","B",,"N","P"
3275,"QUAL É O PLURAL DE PÃO-DE-LÓ?","PÃO-DE-LÓS","PÃO-DE-LÓ","PÃES-DE-LÓ","PÃES-DE-LÓS","3","B",,"N","P"
3307,"A PALAVRA QUE POSSUI ACENTO NA ÚLTIMA SÍLABA RECEBE O NOME DE:","OXÍTONA","PROPAROXÍTONA","PAROXÍTONA","MONOSSÍLABA","1","B",,"N","P"
3350,"A PALAVRA ""POENTE"" REFERE-SE A:","MEIO-DIA","NASCER-DO-SOL","MEIA-NOITE","PÔR-DO-SOL","4","B",,"N","P"
3304,"A PALAVRA RAPINAR TEM O MESMO SIGNIFICADO DE:","ROUBAR","GANHAR","NADAR","CHORAR","1","B",,"N","P"
3337,"A PALAVRA SUPLENTE SIGNIFICA:","INADIMPLENTE","ADIMPLENTE","SUPLICANTE","SUBSTITUTO","4","B",,"N","P"
3338,"A PALAVRA VARIÁVEL QUE PRECEDE O SUBSTANTIVO É CHAMADA DE:","ADVÉRBIO","PREPOSIÇÃO","ARTIGO","VERBO","3","B",,"N","P"
3339,"A QUE ESTA RELACIONADA A PALAVRA CÚMULUS?","NUVENS","RIOS","MARES","MOTORES","1","B",,"N","P"
3340,"A SÍLABA QUE NÃO É TÔNICA É:","DITONGO","ÁTONA","MONOSSÍLABA","PAROXÍTONA","2","B",,"N","P"
3341,"ABOMINAR É:","DETESTAR","ENXUGAR","SAIR","ADORAR","1","B",,"N","P"
3342,"ACENTUAR É O MESMO QUE:","REALÇAR","ABRANDAR","SUAVISAR","ATENUAR","1","B",,"N","P"
3343,"INTRODUÇÃO É...","LAUDA","SUBSCRIÇÃO","PREFÁCIO","DEDICATÓRIA","3","B",,"N","P"
3344,"A PALAVRA MONOCROMÁTICO REFERE-SE À:","MIL CORES","NENHUMA COR","UMA COR","CEM CORES","3","B",,"N","P"
3345,"QUAL É O SINÔNIMO DE QUEDA-D'ÁGUA?","CACHOEIRA","TORNEIRA","CAIXA DÁGUA","CHUVA","1","B",,"N","P"
3346,"QUAL É O PRONOME DE TRATAMENTO UTILIZADO PARA SE DIRIGIR A PRÍNCIPES?","VOSSA SANTIDADE","VOSSA MAGNIFICÊNCIA","VOSSA ALTEZA","VOSSA REALEZA","3","B",,"N","P"
3347,"QUAL É O SIGNIFICADO DA PALAVRA ARCAICO?","SURREAL","ANTIGO","MODERNO","FICTÍCIO","2","B",,"N","P"
3363,"QUAL É O SIGNIFICADO DA PALAVRA ATÔNITO?","INCHADO","ESPANTADO","ALEGRE","ARREPIADO","2","B",,"N","P"
3349,"QUAL É O SIGNIFICADO DA PALAVRA GULEIMA?","FELIZ","COMILÃO","DORMINHOCO","NERVOSO","2","B",,"N","P"
3335,"QUAL É O SINÔNIMO DE ALPINISMO?","MONTAURIENSE","MONTANHISMO","MONTANISMO","MONTANÍSTICA","2","B",,"N","P"
3351,"QUAL É O SINÔNIMO DE ÂNCORA?","ANEMÔMETRO","BIRUTA","POMBEIRA","BARÔMETRO","3","B",,"N","P"
3352,"QUAL É O SINÔNIMO DE EXPATRIAÇÃO?","EXÍLIO","EXTRATO","EXTRALEGAL","EXTRANATURAL","1","B",,"N","P"
3353,"QUAL É O SINÔNIMO DE INTITULAR?","INSTRUIR","DENOMINAR","INTIMIDAR","TRADUZIR","2","B",,"N","P"
3354,"A CONJUGAÇÃO DO VERBO TER NA TERCEIRA PESSOA DO PLURAL NO PRESENTE DO INDICATIVO É:","TÊM","TINHAM","TÊEM","TERIAM","1","B",,"N","P"
3355,"QUAL É O SINÔNIMO DE MOTIM?","MONTE PEQUENO","DIREÇÃO","JARDIM","REVOLTA","4","B",,"N","P"
3356,"A PALAVRA ""AMOR"" É UM SUBSTANTIVO:","CONCRETO","PRÓPRIO","COMUM","ABSTRATO","4","B",,"N","P"
3357,"QUAL É O SINÔNIMO DE SESTA?","HORA DE DESCANSO","UTENSÍLIO DE COZINHA","MOLHO DE CHAVES","NÚMERO DECIMAL","1","B",,"N","P"
3358,"QUAL É O SISTEMA DE GOVERNO DO BRASIL?","DITADURA","IMPERIALISMO","PRESIDENCIALISMO","MONARQUIA","3","B",,"N","P"
3359,"QUAL É O SUPERLATIVO DA PALAVRA POBRE?","PAUPÉRRIMO","POBRETÃO","POBREZÃO","POBREZARRÃO","1","B",,"N","P"
3360,"A PALAVRA DECÁLOGO REFERE-SE À:","DEZ DEDOS","DEZ METROS","DEZ MANDAMENTOS","DEZ ANOS","3","B",,"N","P"
3361,"A PALAVRA CONCERTO REFERE-SE A:","ARRUMAÇÃO","CORREÇÃO","ESPETÁCULO MUSICAL","RESTAURAÇÃO","3","B",,"N","P"
3362,"A PALAVRA ASCENSÃO CORRESPONDE À:","CAIR","SUBIR","DESCER","PARAR","2","B",,"N","P"
3321,"A PALAVRA AFRODISÍACA DERIVA-SE DE QUAL NOME?","AFRINGE","ARTEMIS","AFRODITE","AFRINIGE","3","B",,"N","P"
3319,"A PALAVRA ""QUALQUER"" É UM PRONOME...","INDEFINIDO","DEFINIDO","PESSOAL","NUMERAL","1","B",,"N","P"
3348,"BOM, BELO E INTELIGENTE SÃO:","ADVÉRBIOS","PRONOMES","ANTÔNIMOS","ADJETIVOS","4","B",,"N","P"
3308,"QUAL É O SINÔNIMO DE LABUTA?","LABRADOR","TRABALHO","PENSÃO","CÔMODO","2","B",,"N","P"
3309,"O TERMO DEMOCRACIA, SIGNIFICA:","PODER DO REI","PODER MONETÁRIO","PODER DO POVO","PODER PAPAL","3","B",,"N","P"
3310,"O QUE SIGNIFICA SUS?","SITUAÇÃO UNIVERSAL DE SAÚDE","SISTEMA ÚNICO DE SAÚDE","SISTEMA UNIVERSAL DE SAÚDE","SITUAÇÃO ÚNICA DE SAÚDE","2","B",,"N","P"
3311,"O QUE SIGNIFICA PRESSÁGIO?","TIPO DE PRISÃO","PRESENTIMENTO","IMPOSTO","PESSOA APRESSADA","2","B",,"N","P"
3312,"O QUE SIGNIFICA ORIUNDO?","PROVENIENTE","DISTANTE","PRÓXIMO","ABANDONADO","1","B",,"N","P"
3313,"O QUE SIGNIFICA LATIFÚNDIO?","PEQUENAS EMPRESAS","GRANDES FAZENDAS","PEQUENAS FÁBRICAS","PEQUENAS LOJAS","2","B",,"N","P"
3314,"O QUE SIGNIFICA FOSCO?","SEM BRILHO","TRANSLÚCIDO","TRANSPARENTE","COM BRILHO","1","B",,"N","P"
3315,"O QUE SIGNIFICA EXPEDIR?","TREMER","ENVIAR","ATIRAR","PRENDER","2","B",,"N","P"
3316,"O QUE SIGNIFICA CREPÚSCULO VESPERTINO?","PÔR-DO-SOL","ALVORECER","AMANHECER","CHOVER","1","B",,"N","P"
3317,"O QUE SIGNIFICA CORPUS CHRISTI?","ANTES DE CRISTO","FESTA DO CORPO DE CRISTO","DEPOIS DE CRISTO","PAI DE CRISTO","2","B",,"N","P"
3318,"O QUE SIGNIFICA CASTO?","CULPADO","MALICIOSO","GROSSEIRO","INOCENTE","4","B",,"N","P"
3334,"O QUE SIGNIFICA BURLAR?","RECEITAR","BALANÇAR","PULAR","ENGANAR","4","B",,"N","P"
3320,"O QUE É MAMOTE?","ÁRVORE","TRIBO INDÍGENA","CRIANÇA QUE AINDA MAMA","FRUTO DO SERTÃO","3","B",,"N","P"
